Article,Name,Price,Model,Body,Year,EngineType,Transmission,Bulk,Capbility,Mileage,Mark,Category
не задан,Топливные форсунки и рампа для Chevrolet Cruze J300,4000.00₽,Cruze J300 2008-2014гг,"Седан, Хэтчбек, Универсал",2013,F16D3,передний,1.6,-,70 000 км,Chevrolet,Самовывоз со склада
не задан,Шкив коленвала для Chevrolet Cruze J300,1000.00₽,Cruze J300 2008-2014гг,"Седан, Хэтчбек, Универсал",2013,F16D3,передний,1.6,-,70 000 км,Chevrolet,Самовывоз со склада
не задан,Задний амортизатор для Chevrolet Cruz J300 2013г,1000.00₽,Cruze J300 2008-2014гг,"Седан, Хэтчбек, Универсал",2013,F16D3,передний,-,-,-,Chevrolet,Самовывоз со склада
не задан,Передний левый электро-стеклоподъемник для Chevrolet Cruze 2013г,3500.00₽,Cruze J300 2008-2014гг,"Седан, Хэтчбек, Универсал",2013,-,передний,-,-,-,Chevrolet,Самовывоз со склада
не задан,Задняя наружная левая ручка двери для Chevrolet Cruz J300 2013г,1000.00₽,Cruze J300 2008-2014гг,"Седан, Хэтчбек, Универсал",2013,F16D3,передний,-,-,-,Chevrolet,Самовывоз со склада
не задан,Задний правый брызговик для Chevrolet Cruz J300 2013г,300.00₽,Cruze J300 2008-2014гг,"Седан, Хэтчбек, Универсал",2013,F16D3,передний,-,-,-,Chevrolet,Самовывоз со склада
не задан,Бензонасос для Chevrolet Cruz J300 2013г,5000.00₽,Cruze J300 2008-2014гг,"Седан, Хэтчбек, Универсал",2013,F16D3,передний,-,-,-,Chevrolet,Самовывоз со склада
342,Обшивка двери задней левой для Cruze J300 2008-2014гг,500.00₽,Cruze J300 2008-2014гг,"Седан, Хэтчбек, Универсал",2012,-,передний,-,-,-,Chevrolet,Самовывоз со склада
не задан,Задний левый замок для Chevrolet Cruz J300 2013г,1000.00₽,Cruze J300 2008-2014гг,"Седан, Хэтчбек, Универсал",2013,F16D3,передний,-,-,-,Chevrolet,Самовывоз со склада
370,Обшивка двери передней левой для Cruze J300 2008-2014гг,1500.00₽,Cruze J300 2008-2014гг,"Седан, Хэтчбек, Универсал",2011,-,передний,-,-,-,Chevrolet,Самовывоз со склада
не задан,Задняя левая накладка двери для Chevrolet Cruz J300 2013г,200.00₽,Cruze J300 2008-2014гг,"Седан, Хэтчбек, Универсал",2013,F16D3,передний,-,-,-,Chevrolet,Самовывоз со склада
не задан,Задняя левая форточка для Chevrolet Cruz J300 2013г,500.00₽,Cruze J300 2008-2014гг,"Седан, Хэтчбек, Универсал",2013,F16D3,передний,-,-,-,Chevrolet,Самовывоз со склада
383,Фонарь задний наружный левый для Cruze J300 2008-2014гг,3000.00₽,Cruze J300 2008-2014гг,Хэтчбек,2012,-,передний,-,-,-,Chevrolet,Самовывоз со склада
611,Суппорт передний левый для Cruze J300 2011г.,1500.00₽,Cruze J300 2008-2014гг,"Седан, Хэтчбек, Универсал",2011,-,передний,-,-,-,Chevrolet,Самовывоз со склада
382,Фонарь задний наружный левый для Cruze J300 2011г.,3000.00₽,Cruze J300 2008-2014гг,Хэтчбек,2011,-,передний,-,-,-,Chevrolet,Самовывоз со склада
334,Обшивка двери задней правой для Cruze J300 2008-2014гг,500.00₽,Cruze J300 2008-2014гг,"Седан, Хэтчбек, Универсал",2012,-,передний,-,-,-,Chevrolet,Самовывоз со склада
не задан,Бензонасос для Hyundai Accent LC,2500.00₽,Accent LC 2000-2006,Седан,-,-,предний,-,-,120000 км,Hyundai,Самовывоз со склада
не задан,Топливные форсунки и рампа для Hyundai Accent,2500.00₽,Accent LC 2000-2006,Седан,-,G4EC,предний,-,-,110 000 км,Hyundai,Самовывоз со склада
не задан,Задний правый стоп сигнал для Hyundai Accent,1000.00₽,Accent LC 2000-2006,Седан,-,G4EC,предний,-,-,-,Hyundai,Самовывоз со склада
484,Форсунка инжекторная электрическая для Cruze J300 2008-2014гг,500.00₽,Cruze J300 2008-2014гг,"Седан, Хэтчбек, Универсал",2012,F16D3,передний,-,-,-,Chevrolet,Самовывоз со склада
не задан,Передний тормозной диск для Hyundai Accent,500.00₽,Accent LC 2000-2006,Седан,2005,G4EC,предний,-,-,110 000 км,Hyundai,Самовывоз со склада
394,Фонарь задний наружный правый для Cruze J300 2011г.,3000.00₽,Cruze J300 2008-2014гг,Хэтчбек,2011,-,передний,-,-,-,Chevrolet,Самовывоз со склада
не задан,Передний правый стеклоподъемник для Kia Spectra,1000.00₽,Spectra 2000-2011,Седан,2007,-,передний,-,-,-,Kia,Самовывоз со склада
не задан,Главный тормозной цилиндр и вакуум для Hyundai Accent,2500.00₽,Accent LC 2000-2006,Седан,-,G4EC,предний,-,-,-,Hyundai,Самовывоз со склада
371,Обшивка двери передней правой для Cruze J300 2008-2014гг,1500.00₽,Cruze J300 2008-2014гг,"Седан, Хэтчбек, Универсал",2012,-,передний,-,-,-,Chevrolet,Самовывоз со склада
не задан,Дроссель для Kia Spectra,1500.00₽,Spectra 2000-2011,Седан,-,S6D,передний,-,-,-,Kia,Самовывоз со склада
не задан,Задняя левая дверь в сборе для Kia Spectra,13000.00₽,Spectra 2000-2011,Седан,-,S6D,передний,-,-,-,Kia,Самовывоз со склада
не задан,Бензонасос высокого давления для Kia Spectra,2500.00₽,Spectra 2000-2011,Седан,2007,S6D,передний,-,-,80000 км,Kia,Самовывоз со склада
не задан,Зеркало заднего вида правое для Kia Spectra,2500.00₽,Spectra 2000-2011,Седан,-,S6D,передний,-,-,-,Kia,Самовывоз со склада
не задан,Двигатель ДВС для Kia Spectra,40000.00₽,Spectra 2000-2011,Седан,-,S6D,передний,-,-,115 000 км,Kia,Самовывоз со склада
не задан,Переднее правое стекло для Kia Spectra,1000.00₽,Spectra 2000-2011,Седан,2007,-,передний,-,-,-,Kia,Самовывоз со склада
не задан,Задний левый стоп сигнал для Kia Spectra,2500.00₽,Spectra 2000-2011,Седан,-,S6D,передний,-,-,-,Kia,Самовывоз со склада
не задан,Передний левый суппорт для Hyundai Accent,500.00₽,Accent LC 2000-2006,Седан,2004,G4EC,предний,-,-,110 000 км,Hyundai,Самовывоз со склада
не задан,Передний левый суппорт  для Kia Spectra,500.00₽,Spectra 2000-2011,Седан,2007,-,передний,-,-,-,Kia,Самовывоз со склада
не задан,Зеркало переднее левое для Kia Spectra,2500.00₽,Spectra 2000-2011,Седан,-,S6D,передний,-,-,-,Kia,Самовывоз со склада
не задан,Передний левый рычаг для Kia Spectra,1500.00₽,Spectra 2000-2011,Седан,2007,-,передний,-,-,-,Kia,Самовывоз со склада
не задан,Передний правый привод  для Kia Spectra,7000.00₽,Spectra 2000-2011,Седан,2007,-,передний,-,-,-,Kia,Самовывоз со склада
не задан,Главный тормозной цилиндр для Hyundai Accent 2007г,1500.00₽,Accent LC 2000-2006,Седан,2007,G4EC,предний,-,-,-,Hyundai,Самовывоз со склада
не задан,"Вентилятор охлаждения, диффузор для Hyundai Accent 2007г",1500.00₽,Accent LC 2000-2006,Седан,2007,G4EC,предний,-,-,-,Hyundai,Самовывоз со склада
не задан,Блок переключения печкой для Hyundai Accent 2007г,1000.00₽,Accent LC 2000-2006,Седан,2007,G4EC,предний,-,-,-,Hyundai,Самовывоз со склада
не задан,Переключатель света дворников для Hyundai Accent 2007г,1000.00₽,Accent LC 2000-2006,Седан,2007,G4EC,предний,-,-,-,Hyundai,Самовывоз со склада
не задан,Блок управление стеклоподъемниками для Hyundai Accent 2007г,500.00₽,Accent LC 2000-2006,Седан,2007,G4EC,предний,-,-,-,Hyundai,Самовывоз со склада
не задан,Кислородный датчик для Hyundai Accent 2007г,1000.00₽,Accent LC 2000-2006,Седан,2007,G4EC,предний,-,-,-,Hyundai,Самовывоз со склада
не задан,Правое зеркало заднего вида для Hyundai Accent 2007г,1000.00₽,Accent LC 2000-2006,Седан,2007,G4EC,предний,-,-,-,Hyundai,Самовывоз со склада
не задан,Моторчик передних дворников для Hyundai Accent 2007г,1500.00₽,Accent LC 2000-2006,Седан,2007,G4EC,предний,-,-,-,Hyundai,Самовывоз со склада
не задан,Трубка кондиционера для Hyundai Accent 2007г,1000.00₽,Accent LC 2000-2006,Седан,2007,G4EC,предний,-,-,-,Hyundai,Самовывоз со склада
не задан,Подушка коробки левая для Hyundai Accent 2007г,500.00₽,Accent LC 2000-2006,Седан,2007,G4EC,предний,-,-,-,Hyundai,Самовывоз со склада
не задан,Главный цилиндр сцепления для Hyundai Accent 2007г,500.00₽,Accent LC 2000-2006,Седан,2007,G4EC,предний,-,-,-,Hyundai,Самовывоз со склада
333,Обшивка двери задней правой для Cruze J300 2011г.,500.00₽,Cruze J300 2008-2014гг,"Седан, Хэтчбек, Универсал",2011,-,передний,-,-,-,Chevrolet,Самовывоз со склада
не задан,Трубка охлаждения гура для Hyundai Accent 2007г,500.00₽,Accent LC 2000-2006,Седан,2007,G4EC,предний,-,-,-,Hyundai,Самовывоз со склада
не задан,Радиатор охлаждения мотора для Hyundai Accent 2007г,1500.00₽,Accent LC 2000-2006,Седан,2007,G4EC,предний,-,-,-,Hyundai,Самовывоз со склада
не задан,Контактная группа для Hyundai Accent 2007г,500.00₽,Accent LC 2000-2006,Седан,2007,G4EC,предний,-,-,-,Hyundai,Самовывоз со склада
не задан,Подушка мотора правая для Hyundai Accent 2007г,500.00₽,Accent LC 2000-2006,Седан,2007,G4EC,предний,-,-,-,Hyundai,Самовывоз со склада
354,Обшивка двери передней левой для Cruze J300 2012г,1500.00₽,Cruze J300 2008-2014гг,"Седан, Хэтчбек, Универсал",2012,-,-,-,-,-,Chevrolet,Самовывоз со склада
475,Насос топливный электрический для Cruz 2012г,3500.00₽,Cruze J300 2008-2014гг,"Седан, Хэтчбек, Универсал",2012,-,передний,-,-,120 000 км,Chevrolet,Самовывоз со склада
369,Обшивка двери передней левой для Cruze J300 2011г,1500.00₽,Cruze J300 2008-2014гг,"Седан, Хэтчбек, Универсал",2011,-,передний,-,-,-,Chevrolet,Самовывоз со склада
359,Обшивка двери задней левой для Cruze J300 2012г.,500.00₽,Cruze J300 2008-2014гг,"Седан, Хэтчбек, Универсал",2012,-,передний,-,-,-,Chevrolet,Самовывоз со склада
339,Обшивка двери передней правой для Cruze J300 2011г.,1500.00₽,Cruze J300 2008-2014гг,"Седан, Хэтчбек, Универсал",2011,-,передний,-,-,-,Chevrolet,Самовывоз со склада
не задан,Корпус воздушного фильтра для Hyundai Accent 2007г,1500.00₽,Accent LC 2000-2006,Седан,2007,G4EC,предний,-,-,-,Hyundai,Самовывоз со склада
456,Насос топливный электрический для Cruz 2011г,5000.00₽,Cruze J300 2008-2014гг,"Седан, Хэтчбек, Универсал",2011,"F18D4, Z18XER",передний,1.8,-,40 000 км,Chevrolet,Самовывоз со склада
не задан,Корзина сцепления для Chevrolet Cruze J300,1000.00₽,Cruze J300 2008-2014гг,"Седан, Хэтчбек, Универсал",2013,F16D3,передний,1.6,-,60 000 км,Chevrolet,Самовывоз со склада
не задан,Крыло переднее левое для Chevrolet Cruze J300,4000.00₽,Cruze J300 2008-2014гг,"Седан, Хэтчбек, Универсал",2013,F16D3,передний,1.6,-,60 000 км,Chevrolet,Самовывоз со склада
не задан,Левое зеркало заднего вида для Chevrolet Cruze J300,5000.00₽,Cruze J300 2008-2014гг,"Седан, Хэтчбек, Универсал",2013,F16D3,передний,1.6,-,60 000 км,Chevrolet,Самовывоз со склада
не задан,Крышка багажника + заднее стекло для Chevrolet Cruze J300,20000.00₽,Cruze J300 2008-2014гг,"Седан, Хэтчбек, Универсал",2013,F16D3,передний,1.6,-,60 000 км,Chevrolet,Самовывоз со склада
не задан,Механическая коробка передач (МКПП) для Chevrolet Cruze J300,25000.00₽,Cruze J300 2008-2014гг,"Седан, Хэтчбек, Универсал",2013,F16D3,передний,1.6,-,60 000 км,Chevrolet,Самовывоз со склада
не задан,Насос кондиционера для Chevrolet Cruze J300,6000.00₽,Cruze J300 2008-2014гг,"Седан, Хэтчбек, Универсал",2013,F16D3,передний,1.6,-,60 000 км,Chevrolet,Самовывоз со склада
не задан,Модуль зажигания для Chevrolet Cruze J300,2000.00₽,Cruze J300 2008-2014гг,"Седан, Хэтчбек, Универсал",2013,F16D3,передний,1.6,-,60 000 км,Chevrolet,Самовывоз со склада
не задан,"Передний бампер, решетка радиатора для Chevrolet Cruze J300",12000.00₽,Cruze J300 2008-2014гг,"Седан, Хэтчбек, Универсал",2013,F16D3,передний,1.6,-,60 000 км,Chevrolet,Самовывоз со склада
не задан,Корпус воздушного фильтра для Chevrolet Cruze J300,1000.00₽,Cruze J300 2008-2014гг,"Седан, Хэтчбек, Универсал",2013,F16D3,передний,1.6,-,60 000 км,Chevrolet,Самовывоз со склада
не задан,Передний левый рычаг для Chevrolet Cruze J300,3500.00₽,Cruze J300 2008-2014гг,"Седан, Хэтчбек, Универсал",2013,F16D3,передний,1.6,-,60 000 км,Chevrolet,Самовывоз со склада
не задан,Обшивка задней правой двери для Chevrolet Cruze J300,1000.00₽,Cruze J300 2008-2014гг,"Седан, Хэтчбек, Универсал",2013,F16D3,передний,1.6,-,60 000 км,Chevrolet,Самовывоз со склада
не задан,Передний левый суппорт  для Chevrolet Cruze J300,1500.00₽,Cruze J300 2008-2014гг,"Седан, Хэтчбек, Универсал",2011,F16D3,передний,1.6,-,60 000 км,Chevrolet,Самовывоз со склада
не задан,Передний подрамник подвески для Chevrolet Cruze J300,10000.00₽,Cruze J300 2008-2014гг,"Седан, Хэтчбек, Универсал",2013,F16D3,передний,1.6,-,60 000 км,Chevrolet,Самовывоз со склада
не задан,Крыло переднее правое для Chevrolet Cruze J300,4000.00₽,Cruze J300 2008-2014гг,"Седан, Хэтчбек, Универсал",2013,F16D3,передний,1.6,-,60 000 км,Chevrolet,Самовывоз со склада
не задан,"Передняя блок-ступица, тормозной диск для Chevrolet Cruze J300",2500.00₽,Cruze J300 2008-2014гг,"Седан, Хэтчбек, Универсал",2011,F16D3,передний,1.6,-,60 000 км,Chevrolet,Самовывоз со склада
не задан,Передний правый привод (МКПП) для Chevrolet Cruze J300,5000.00₽,Cruze J300 2008-2014гг,"Седан, Хэтчбек, Универсал",2013,F16D3,передний,1.6,-,60 000 км,Chevrolet,Самовывоз со склада
не задан,Передний тормозной диск для Chevrolet Cruze J300,500.00₽,Cruze J300 2008-2014гг,"Седан, Хэтчбек, Универсал",2011,F16D3,передний,1.6,-,60 000 км,Chevrolet,Самовывоз со склада
не задан,Мультимедия для Chevrolet Cruze J300,5000.00₽,Cruze J300 2008-2014гг,"Седан, Хэтчбек, Универсал",2013,F16D3,передний,1.6,-,60 000 км,Chevrolet,Самовывоз со склада
не задан,Передняя левая стойка в сборе для Chevrolet Cruze J300,10000.00₽,Cruze J300 2008-2014гг,"Седан, Хэтчбек, Универсал",2013,F16D3,передний,1.6,-,60 000 км,Chevrolet,Самовывоз со склада
не задан,Передний левый привод (МКПП) для Chevrolet Cruze J300,5000.00₽,Cruze J300 2008-2014гг,"Седан, Хэтчбек, Универсал",2013,F16D3,передний,1.6,-,60 000 км,Chevrolet,Самовывоз со склада
не задан,Передняя правая стойка в сборе для Chevrolet Cruze J300,10000.00₽,Cruze J300 2008-2014гг,"Седан, Хэтчбек, Универсал",2013,F16D3,передний,1.6,-,60 000 км,Chevrolet,Самовывоз со склада
не задан,Передняя правая фара для Chevrolet Cruze J300,6000.00₽,Cruze J300 2008-2014гг,"Седан, Хэтчбек, Универсал",2013,F16D3,передний,1.6,-,60 000 км,Chevrolet,Самовывоз со склада
не задан,Правое зеркало заднего вида для Chevrolet Cruze J300,5000.00₽,Cruze J300 2008-2014гг,"Седан, Хэтчбек, Универсал",2013,F16D3,передний,1.6,-,60 000 км,Chevrolet,Самовывоз со склада
не задан,Передняя левая дверь в сборе для Chevrolet Cruze J300,25000.00₽,Cruze J300 2008-2014гг,"Седан, Хэтчбек, Универсал",2013,F16D3,передний,1.6,-,60 000 км,Chevrolet,Самовывоз со склада
не задан,Передний правый рычаг для Chevrolet Cruze J300,3500.00₽,Cruze J300 2008-2014гг,"Седан, Хэтчбек, Универсал",2013,F16D3,передний,1.6,-,60 000 км,Chevrolet,Самовывоз со склада
не задан,Передняя правая дверь в сборе для Chevrolet Cruze J300,25000.00₽,Cruze J300 2008-2014гг,"Седан, Хэтчбек, Универсал",2013,F16D3,передний,1.6,-,60 000 км,Chevrolet,Самовывоз со склада
не задан,"Рамка радиатора, передний бампер для Chevrolet Cruze J300",2000.00₽,Cruze J300 2008-2014гг,"Седан, Хэтчбек, Универсал",2013,F16D3,передний,1.6,-,60 000 км,Chevrolet,Самовывоз со склада
не задан,Радиатор охлаждения (МКПП) для Chevrolet Cruze J300,5000.00₽,Cruze J300 2008-2014гг,"Седан, Хэтчбек, Универсал",2013,F16D3,передний,1.6,-,60 000 км,Chevrolet,Самовывоз со склада
не задан,Задний стоп сигнал правый для SsangYong Actyon,2500.00₽,Actyon 2005-2010,Кроссовер,2008,-,"полный, задний",-,-,-,SsangYong,Самовывоз со склада
не задан,Задний стоп сигнал левый для SsangYong Actyon,2500.00₽,Actyon 2005-2010,Кроссовер,2008,-,"полный, задний",-,-,-,SsangYong,Самовывоз со склада
не задан,Электропроводка для Hyundai Accent 2007г,2000.00₽,Accent LC 2000-2006,Седан,2007,G4EC,предний,-,-,-,Hyundai,Самовывоз со склада
2,Коленвал для Chevrolet Epica 2006-2012гг,2000.00₽,Epica 2006-2012гг,Седан,2007,X20D1,передний,-,под ремонт,-,Chevrolet,Самовывоз со склада
не задан,Передняя пружина для Chevrolet Cruze J300,500.00₽,Cruze J300 2008-2014гг,"Седан, Хэтчбек, Универсал",2013,F16D3,передний,1.6,-,60 000 км,Chevrolet,Самовывоз со склада
287,Глушитель основной для Chevrolet Niva I 2009-2015гг.,500.00₽,Niva I 2009-2015гг,Внедорожник,2008,-,полный,1.7,-,80000 км,Chevrolet,Самовывоз со склада
3,Блок целиндров для Chevrolet Epica 2007г,10000.00₽,Epica 2006-2012гг,Седан,2007,X20D1,-,2.0,-,95.000,Chevrolet,Самовывоз со склада
278,Гофра впускная Chevrolet Niva I 2009-2015гг.,500.00₽,Niva I 2009-2015гг,Внедорожник,2008,-,полный,-,-,80 000 км,Chevrolet,Самовывоз со склада
не задан,Задняя подушка коробки для Chevrolet Aveo T250 2010г,500.00₽,Aveo Т250 2007-2011гг,"Седан, Хэтчбек",2010,F14D4,передний,-,-,-,Chevrolet,Самовывоз со склада
270,Датчик расхода воздуха Chevrolet Niva I 2009-2015гг.,1500.00₽,Niva I 2009-2015гг,Внедорожник,-,-,полный,-,-,-,Chevrolet,Самовывоз со склада
не задан,Задний левый суппорт для SsangYong Actyon,2500.00₽,Actyon 2005-2010,Кроссовер,2008,-,"полный, задний",-,-,-,SsangYong,Самовывоз со склада
292,Раздаточная коробка Chevrolet Niva I 2009-2015гг.,6000.00₽,Niva I 2009-2015гг,Внедорожник,2008,-,полный,1.7,-,140 000 км,Chevrolet,Самовывоз со склада
269,Гофра впускная 1 Chevrolet Niva I 2009-2015гг.,300.00₽,Niva I 2009-2015гг,Внедорожник,2008,-,полный,-,-,80000 км,Chevrolet,Самовывоз со склада
не задан,Катализатор для Chevrolet Aveo T250 2010г,2000.00₽,Aveo Т250 2007-2011гг,"Седан, Хэтчбек",2010,B12S1,передний,-,-,93000,Chevrolet,Самовывоз со склада
280,Суппорт передний правый для Chevrolet Niva I 2009-2015гг.,500.00₽,Niva I 2009-2015гг,Внедорожник,2008,-,полный,-,-,80000 км,Chevrolet,Самовывоз со склада
не задан,Корпус печки для Chevrolet Aveo T250 2010г,2000.00₽,Aveo Т250 2007-2011гг,"Седан, Хэтчбек",2010,F14D4,передний,-,-,-,Chevrolet,Самовывоз со склада
не задан,Передний левый суппорт для Chevrolet Aveo T250 2010г,1000.00₽,Aveo Т250 2007-2011гг,"Седан, Хэтчбек",2010,B12S1,передний,-,-,93000,Chevrolet,Самовывоз со склада
не задан,Передний правый брызговик для Chevrolet Aveo T250 2010г,200.00₽,Aveo Т250 2007-2011гг,"Седан, Хэтчбек",2010,F14D4,передний,-,-,-,Chevrolet,Самовывоз со склада
не задан,Привод передний левый для Chevrolet Aveo T250 2010г,2500.00₽,Aveo Т250 2007-2011гг,"Седан, Хэтчбек",2010,B12S1,передний,-,-,93000,Chevrolet,Самовывоз со склада
не задан,Корзина сцепления для Chevrolet Aveo T250 2010г,1000.00₽,Aveo Т250 2007-2011гг,"Седан, Хэтчбек",2010,B12S1,передний,-,-,93000,Chevrolet,Самовывоз со склада
не задан,Главный цилиндр сцепления для Chevrolet Aveo T250 2010г,500.00₽,Aveo Т250 2007-2011гг,"Седан, Хэтчбек",2010,F14D4,передний,-,-,-,Chevrolet,Самовывоз со склада
не задан,Радиатор охлаждения для Chevrolet Aveo T250 2010г,2000.00₽,Aveo Т250 2007-2011гг,"Седан, Хэтчбек",2010,B12S1,передний,-,-,93000,Chevrolet,Самовывоз со склада
