Article,Name,Price,Model,Body,Year,EngineType,Transmission,Bulk,Capbility,Mileage,Mark,Category
не задан,Насос кондиционера для Chevrolet Aveo T200 2009г,6000.00₽,Aveo T200 2002-2007гг,"Седан, Хэтчбек",2009,B12D1,передний,-,-,-,Chevrolet,Самовывоз со склада
не задан,Моторчик печки для Chevrolet Aveo T200 2006г,2000.00₽,Aveo T200 2002-2007гг,"Седан, Хэтчбек",2006,F14D3,передний,-,-,-,Chevrolet,Самовывоз со склада
не задан,Замок зажигания для Chevrolet Aveo T200 2006г,1500.00₽,Aveo T200 2002-2007гг,"Седан, Хэтчбек",2006,F14D3,передний,-,-,-,Chevrolet,Самовывоз со склада
не задан,Блок переключения печкой для Chevrolet Aveo T200 2006г,500.00₽,Aveo T200 2002-2007гг,"Седан, Хэтчбек",2006,F14D3,передний,-,-,-,Chevrolet,Самовывоз со склада
не задан,Панель приборов для Chevrolet Aveo T200 2006г,2000.00₽,Aveo T200 2002-2007гг,"Седан, Хэтчбек",2006,F14D3,передний,-,-,-,Chevrolet,Самовывоз со склада
не задан,Средняя консоль торпеды для Chevrolet Aveo T200 2006г,500.00₽,Aveo T200 2002-2007гг,"Седан, Хэтчбек",2006,F14D3,передний,-,-,-,Chevrolet,Самовывоз со склада
не задан,Салонный радиатор кондиционера для Chevrolet Aveo T200 2006г,1000.00₽,Aveo T200 2002-2007гг,"Седан, Хэтчбек",2006,F14D3,передний,-,-,-,Chevrolet,Самовывоз со склада
747,Бак топливный для Aveo T200 2002-2007гг,2000.00₽,Aveo T200 2002-2007гг,"Седан, Хэтчбек",2006,-,передний,-,-,-,Chevrolet,Самовывоз со склада
не задан,"Переключатель света, дворников для Chevrolet Aveo T200 2006г",500.00₽,Aveo T200 2002-2007гг,"Седан, Хэтчбек",2006,F14D3,передний,-,-,-,Chevrolet,Самовывоз со склада
672,Амортизатор передний правый для Aveo T200 2002-2007гг,1500.00₽,Aveo T200 2002-2007гг,"Седан, Хэтчбек",2002-2007,-,передний,-,-,-,Chevrolet,Самовывоз со склада
не задан,Радиатор печки для Chevrolet Aveo T200 2006г,1000.00₽,Aveo T200 2002-2007гг,"Седан, Хэтчбек",2006,F14D3,передний,-,-,-,Chevrolet,Самовывоз со склада
748,Приемная труба глушителя для Aveo T200 2002-2007гг,1000.00₽,Aveo T200 2002-2007гг,"Седан, Хэтчбек",2006,F14D3,передний,-,-,-,Chevrolet,Самовывоз со склада
300,Моторчик стеклоочистителя передний для Aveo T200 2005г,1500.00₽,Aveo T200 2002-2007гг,"Седан, Хэтчбек",2005,-,передний,-,-,-,Chevrolet,Самовывоз со склада
не задан,Катушка зажигания для Kia Ceed 2008г,1000.00₽,Ceed 2006-2012,"Хэтчбек, Универсал",2008,-,передний,-,-,-,Kia,Самовывоз со склада
745,Глушитель основной для Aveo T200 2002-2007гг,1000.00₽,Aveo T200 2002-2007гг,"Седан, Хэтчбек",2002,F14D3,передний,-,-,-,Chevrolet,Самовывоз со склада
не задан,Топливная форсунка для Kia Ceed 2008г,500.00₽,Ceed 2006-2012,"Хэтчбек, Универсал",2008,-,передний,-,-,-,Kia,Самовывоз со склада
240,Обшивка двери задней правой для Ceed 2006-2012,500.00₽,Ceed 2006-2012,-,2008,-,передний,-,-,-,Kia,Самовывоз со склада
356,Обшивка двери передней правой для Aveo T200 2002-2007гг,500.00₽,Aveo T200 2002-2007гг,"Седан, Хэтчбек",2002-2007,-,передний,-,-,-,Chevrolet,Самовывоз со склада
746,Средняя часть глушителя для Aveo T200 2002-2007гг,1000.00₽,Aveo T200 2002-2007гг,"Седан, Хэтчбек",2006,F14D3,передний,-,-,-,Chevrolet,Самовывоз со склада
263,Датчик ABS задний правый для Rio UB 2011-2017,500.00₽,Rio UB 2011-2017,Седан,2013,G4FC,передний,1.6,-,60 000 км,Kia,Самовывоз со склада
243,Петля двери задней правой нижняя для Ceed 2006-2012,300.00₽,Ceed 2006-2012,Хэтчбек,2008,-,передний,-,-,-,Kia,Самовывоз со склада
не задан,"Задний кардан (АКПП, бензин) для Kia Sorento BL",5000.00₽,Sorento BL 2002-2009,Внедорожник,2007,-,"передний, полный",3.3,-,-,Kia,Самовывоз со склада
не задан,Задняя правая дверь для Kia Sorento XM 2012г,3000.00₽,Sorento XM 2009-2014,Внедорожник,2012,-,"передний, полный",-,-,-,Kia,Самовывоз со склада
267,Турбина для Santa Fe (SM) 2000-2005,15000.00₽,Santa Fe (SM) 2000-2005,Внедорожник,2008,D4EA,полный,2.0,-,115 000 км,Hyundai,Самовывоз со склада
247,Накладка двери задней правой внутреняя,200.00₽,Ceed 2006-2012,-,2008,-,-,-,-,-,Kia,Самовывоз со склада
14,Патрубок воздушного фильтра для Santa Fe (SM) 2000-2005,500.00₽,Santa Fe (SM) 2000-2005,Кроссовер,-,D4EA,передний,2.0,-,-,Hyundai,Самовывоз со склада
не задан,Дроссельная заслонка для Kia Rio UB,5000.00₽,Rio UB 2011-2017,"Седан, Хэтчбек",2010,G4FC,передний,-,-,-,Kia,Самовывоз со склада
не задан,Задняя пружина для Hyundai Solaris,500.00₽,Solaris 2010-2017,"Седан, Хэтчбек",2013,-,передний,-,-,-,Hyundai,Самовывоз со склада
244,Петля двери задней правой верхняя для Ceed 2006-2012,300.00₽,Ceed 2006-2012,Хэтчбек,-,-,передний,-,-,-,Kia,Самовывоз со склада
не задан,Передняя правая фара для Hyundai Sonata EF,1500.00₽,Sonata EF 1997-2003,Седан,2001,-,передний,-,-,-,Hyundai,Самовывоз со склада
не задан,Главный тормозной цилиндр для Kia Cerato LD 2008г,2500.00₽,Cerato LD 2003-2009,"Седан, Хэтчбек",2008,G4FC,передний,-,-,-,Kia,Самовывоз со склада
не задан,Переднее правое зеркало заднего вида для Hyundai Matrix,3500.00₽,Matrix 2001-2005,Минивэн,2011,-,передний,-,-,-,Hyundai,Самовывоз со склада
не задан,Крышка багажника (серая) для Daewoo Nexia 2000г,1000.00₽,Nexia I 1995-2008гг,Седан,2000,-,передний,-,-,-,Daewoo,Самовывоз со склада
74,Фонарь задний наружный левый для ix35 2013г.,2500.00₽,Hyundai ix35,Кроссовер,2013,-,передний,-,-,80000,Hyundai,Самовывоз со склада
не задан,Задний левый стоп сигнал для Chevrolet Sens,500.00₽,Sens L-1300 2002-2016,"Седан, Хэтчбек",2005,-,передний,-,-,-,Chevrolet,Самовывоз со склада
не задан,Передняя левая дверь (с дефектом) для Kia Ceed 2013г,25000.00₽,Ceed 2013-2017,"Хэтчбек, Универсал",2013,-,передний,-,-,-,Kia,Самовывоз со склада
не задан,Передняя подушка мотора для Daewoo Matiz 2008г,300.00₽,Matiz M200 2005-2010гг,Хэтчбек,2008,B10S1,передний,-,-,-,Daewoo,Самовывоз со склада
не задан,Бензонасос для Chevrolet Spark M250,1500.00₽,Spark M300 2009-2015гг,Хэтчбек,2007,-,передний,-,-,40000 км,Chevrolet,Самовывоз со склада
не задан,Автомат дроссель для Hyundai Sonata EF,2000.00₽,Sonata EF 1997-2003,Седан,2001,-,передний,2.4,-,-,Hyundai,Самовывоз со склада
не задан,Крышка багажника для Chevrolet Sens 2013г,3000.00₽,Sens L-1300 2002-2016,"Седан, Хэтчбек",2013,-,передний,-,-,-,Chevrolet,Самовывоз со склада
не задан,Передний правый стеклоподъемник для Chevrolet Niva,500.00₽,Niva I 2002-2008гг,Кроссовер,2008,-,полный,-,-,-,Chevrolet,Самовывоз со склада
не задан,Задний карданный вал для Chevrolet Niva 2008г,1000.00₽,Niva I 2002-2008гг,Кроссовер,2008,-,полный,-,-,-,Chevrolet,Самовывоз со склада
не задан,Задняя часть кузова для Chevrolet Niva 2008г,5000.00₽,Niva I 2002-2008гг,Кроссовер,2008,-,полный,-,-,-,Chevrolet,Самовывоз со склада
не задан,Переднее право стекло для Chevrolet Niva,500.00₽,Niva I 2002-2008гг,Кроссовер,2008,-,полный,-,-,-,Chevrolet,Самовывоз со склада
не задан,Генератор для Chevrolet Aveo T250 2010г,3000.00₽,Aveo Т250 2007-2011гг,"Седан, Хэтчбек",2010,B12S1,передний,-,-,93000,Chevrolet,Самовывоз со склада
не задан,Впускной коллектор для Chevrolet Aveo T250 2010г,3000.00₽,Aveo Т250 2007-2011гг,"Седан, Хэтчбек",2010,B12S1,передний,-,-,93000,Chevrolet,Самовывоз со склада
489,Форсунки инжекторные электрические для Epica 2006-2012гг,500.00₽,Epica,Седан,2006-2012,-,-,-,-,-,Chevrolet,Самовывоз со склада
не задан,Топливные форсуни и рампа для Hyundai Elantra,2000.00₽,Elantra HD 2005-2010,Седан,2004,G4ED,предний,-,-,-,Hyundai,Самовывоз со склада
1,Шкив коленвала для Epica 2006-2012гг,500.00₽,Epica 2006-2012гг,-,2007,X20D1,передний,2,-,-,Chevrolet,Самовывоз со склада
100,Дверь задняя правая для Rezzo 2000-2008гг,8000.00₽,Rezzo 2000-2008гг,Минивэн,2008,-,передний,-,-,180000 км,Chevrolet,Самовывоз со склада
не задан,Задний кардан для SsangYong Actyon (АКПП),5000.00₽,Actyon 2005-2010,Кроссовер,2008,-,"полный, задний",2.0,-,-,SsangYong,Самовывоз со склада
373,Обшивка двери задней левой для Cruze J300 2011г.,500.00₽,Cruze J300 2008-2014гг,"Седан, Хэтчбек, Универсал",2011,-,передний,-,-,-,Chevrolet,Самовывоз со склада
406,Фонарь задний наружный правый для Cruze J300 2008-2014гг,3000.00₽,Cruze J300 2008-2014гг,Хэтчбек,2012,-,передний,-,-,-,Chevrolet,Самовывоз со склада
не задан,Передний правый суппорт для Kia Spectra,500.00₽,Spectra 2000-2011,Седан,2007,-,передний,-,-,-,Kia,Самовывоз со склада
не задан,Передняя правая обшивка салона для Kia Spectra,500.00₽,Spectra 2000-2011,Седан,2007,-,передний,-,-,-,Kia,Самовывоз со склада
708,Амортизатор задний для Cruze J300 2008-2014гг,1000.00₽,Cruze J300 2008-2014гг,"Седан, Хэтчбек, Универсал",2012,-,передний,-,-,377 км,Chevrolet,Самовывоз со склада
не задан,Передняя левая дверь в сборе для Kia Spectra,15000.00₽,Spectra 2000-2011,Седан,-,-,передний,-,-,-,Kia,Самовывоз со склада
не задан,Генератор для Kia Spectra 2008г,4000.00₽,Spectra 2000-2011,Седан,2008,S6D,передний,-,-,115 000 км,Kia,Самовывоз со склада
не задан,Противотуманка передняя для Kia Spectra,500.00₽,Spectra 2000-2011,Седан,-,-,передний,-,-,-,Kia,Самовывоз со склада
не задан,Передняя правая цапфа (кулак) для Kia Spectra,2000.00₽,Spectra 2000-2011,Седан,-,-,передний,-,-,-,Kia,Самовывоз со склада
не задан,Коробка передач МКПП для Kia Spectra 2008г,15000.00₽,Spectra 2000-2011,Седан,2008,S6D,передний,-,-,115 000 км,Kia,Самовывоз со склада
не задан,Передняя левая цапфа (кулак) для Kia Spectra,2000.00₽,Spectra 2000-2011,Седан,-,-,передний,-,-,-,Kia,Самовывоз со склада
не задан,Передний левый привод для Kia Spectra 2008г,4000.00₽,Spectra 2000-2011,Седан,2008,S6D,передний,-,-,115 000 км,Kia,Самовывоз со склада
не задан,Катушка зажигания для Kia Spectra 2008г,15000.00₽,Spectra 2000-2011,Седан,2008,S6D,передний,-,-,115 000 км,Kia,Самовывоз со склада
не задан,Передний правый рычаг для Kia Spectra 2008г,1500.00₽,Spectra 2000-2011,Седан,2008,S6D,передний,-,-,63 000 км,Kia,Самовывоз со склада
не задан,Передняя подушка мотора для Kia Spectra 2008г,500.00₽,Spectra 2000-2011,Седан,2008,S6D,передний,-,-,115 000 км,Kia,Самовывоз со склада
не задан,Правая подушка мотора для Kia Spectra 2008г,500.00₽,Spectra 2000-2011,Седан,2008,S6D,передний,-,-,115 000 км,Kia,Самовывоз со склада
не задан,Насос гидроусилителя руля для Kia Spectra 2008г,3000.00₽,Spectra 2000-2011,Седан,2008,S6D,передний,-,-,115 000 км,Kia,Самовывоз со склада
не задан,Передний правый тормозной суппорт для Kia Spectra 2008г,1000.00₽,Spectra 2000-2011,Седан,2008,S6D,передний,-,-,115 000 км,Kia,Самовывоз со склада
не задан,Форсунки (4 шт.) для Kia Spectra 2008г,2000.00₽,Spectra 2000-2011,Седан,2008,S6D,передний,-,-,115 000 км,Kia,Самовывоз со склада
не задан,Топлевные форсунки и рейка для Kia Spectra,2000.00₽,Spectra 2000-2011,Седан,-,S6D,передний,-,-,35 000 км,Kia,Самовывоз со склада
не задан,Заднее правое стекло для Kia Spectra 2007г,500.00₽,Spectra 2000-2011,Седан,2007,S6D,передний,-,-,-,Kia,Самовывоз со склада
не задан,Промежуточный вал правого привода МКПП для Kia Spectra 2008г,2000.00₽,Spectra 2000-2011,Седан,2008,S6D,передний,-,-,115 000 км,Kia,Самовывоз со склада
не задан,Маховик МКПП для Kia Spectra 2008г,1000.00₽,Spectra 2000-2011,Седан,2008,S6D,передний,-,-,115 000 км,Kia,Самовывоз со склада
не задан,"Блок управление раздаткой для Kia Sorento BL, бензин",2000₽,Sorento BL 2002-2009,Внедорожник,2007,-,"передний, полный",3.3,-,-,Kia,Самовывоз со склада
не задан,Фара левая с дефектом для Kia Sorento BL,2000.00₽,Sorento BL 2002-2009,Внедорожник,2007,-,"передний, полный",-,-,-,Kia,Самовывоз со склада
291,Усилитель тормозов вакуумный для Spectra 2000-2011,1000.00₽,Spectra 2000-2011,Седан,2008,S6D,передний,1.6,-,80000 км,Kia,Самовывоз со склада
257,ШРУС наружный передний для Spectra 2000-2011,2500.00₽,Spectra 2000-2011,Седан,2008,S6D,передний,1.6,-,60 000 км,Kia,Самовывоз со склада
9,Вентилятор радиатора кондицеонера для Spectra 2000-2011,1500.00₽,Spectra 2000-2011,Седан,2008,S6D,передний,1.6,-,60 000 км,Kia,Самовывоз со склада
10,Вентилятор радиатора для Spectra 2000-2011,1500.00₽,Spectra 2000-2011,Седан,2008,S6D,передний,1.6,-,80000 км,Kia,Самовывоз со склада
290,Рейка рулевая для Spectra 2000-2011,5000.00₽,Spectra 2000-2011,Седан,2008,S6D,передний,1.6,-,80000 км,Kia,Самовывоз со склада
не задан,Задний правый электростеклоподъемник для Kia Spectra 2007г,500.00₽,Spectra 2000-2011,Седан,2007,S6D,передний,-,-,-,Kia,Самовывоз со склада
259,Катушка зажигания для Spectra 2000-2011,1500.00₽,Spectra 2000-2011,Седан,2008,S6D,передний,1.6,-,93000,Kia,Самовывоз со склада
709,Амортизатор передний правый для Cruze J300 2008-2014гг,1500.00₽,Cruze J300 2008-2014гг,"Седан, Хэтчбек, Универсал",2012,-,передний,-,-,-,Chevrolet,Самовывоз со склада
256,Рейка топливная (рампа) с форсунками,2000.00₽,Spectra 2000-2011,Седан,2008,S6D,передний,1.6,-,80 000 км,Kia,Самовывоз со склада
663,Рычаг передний правый для Cruze J300 2008-2014гг,2500.00₽,Cruze J300 2008-2014гг,"Седан, Хэтчбек, Универсал",2012,-,передний,-,-,-,Chevrolet,Самовывоз со склада
613,Кулак поворотный передний левый для Cruze J300 2008-2014гг,2500.00₽,Cruze J300 2008-2014гг,"Седан, Хэтчбек, Универсал",2012,-,передний,-,-,-,Chevrolet,Самовывоз со склада
не задан,Стартер для Kia Spectra 2008г,4000.00₽,Spectra 2000-2011,Седан,2008,S6D,передний,-,-,115 000 км,Kia,Самовывоз со склада
713,Амортизатор передний левый для Cruze J300 2008-2014гг,1500.00₽,Cruze J300 2008-2014гг,"Седан, Хэтчбек, Универсал",2011,-,передний,-,-,-,Chevrolet,Самовывоз со склада
614,Суппорт передний левый для Cruze J300 2008-2014гг,1500.00₽,Cruze J300 2008-2014гг,"Седан, Хэтчбек, Универсал",2012,-,передний,-,-,-,Chevrolet,Самовывоз со склада
470,Насос топливный электрический для Cruze J300 2008-2014гг,5000.00₽,Cruze J300 2008-2014гг,"Седан, Хэтчбек, Универсал",2012,F18D4,передний,1.8,-,-,Chevrolet,Самовывоз со склада
615,Ступица задняя для Cruze J300 2008-2014гг,1500.00₽,Cruze J300 2008-2014гг,"Седан, Хэтчбек, Универсал",2012,-,передний,-,-,-,Chevrolet,Самовывоз со склада
612,Кулак поворотный передний правый для Cruze J300 2011г.,2500.00₽,Cruze J300 2008-2014гг,"Седан, Хэтчбек, Универсал",2011,-,передний,-,-,-,Chevrolet,Самовывоз со склада
500,Форсунки инжекторные электрические для Cruze J300 2011г.,2000.00₽,Cruze J300 2008-2014гг,"Седан, Хэтчбек, Универсал",2011,-,передний,-,-,-,Chevrolet,Самовывоз со склада
494,Форсунки инжекторные электрические для Cruze J300 2008-2014гг.,2000.00₽,Cruze J300 2008-2014гг,"Седан, Хэтчбек, Универсал",2012,-,передний,-,-,-,Chevrolet,Самовывоз со склада
668,Суппорт задний левый для Cruze J300 2008-2014гг.,2500.00₽,Cruze J300 2008-2014гг,"Седан, Хэтчбек, Универсал",2012,-,передний,-,-,-,Chevrolet,Самовывоз со склада
662,Суппорт передний правый для Cruze J300 2008-2014гг,1500.00₽,Cruze J300 2008-2014гг,"Седан, Хэтчбек, Универсал",2012,-,передний,-,-,-,Chevrolet,Самовывоз со склада
258,Шрус внутренний передний правый для Spectra 2000-2011,3000.00₽,Spectra 2000-2011,Седан,2008,S6D,передний,1.6,-,60 000 км,Kia,Самовывоз со склада
609,Ступица задняя для Cruze J300 2011г.,1500.00₽,Cruze J300 2008-2014гг,"Седан, Хэтчбек, Универсал",2011,-,передний,-,-,-,Chevrolet,Самовывоз со склада
608,Суппорт передний правый для Cruze J300 2011г.,1500.00₽,Cruze J300 2008-2014гг,"Седан, Хэтчбек, Универсал",2011,-,передний,-,-,-,Chevrolet,Самовывоз со склада
661,Кулак поворотный передний правый для Cruze J300 2012г.,2500.00₽,Cruze J300 2008-2014гг,"Седан, Хэтчбек, Универсал",2012,-,передний,-,-,-,Chevrolet,Самовывоз со склада
не задан,Стартер для Chevrolet Cruze J300,4000.00₽,Cruze J300 2008-2014гг,"Седан, Хэтчбек, Универсал",2013,F16D3,передний,1.6,-,60 000 км,Chevrolet,Самовывоз со склада
не задан,Радиатор охлождения гидроусилителя для Chevrolet Cruze J300,2000.00₽,Cruze J300 2008-2014гг,"Седан, Хэтчбек, Универсал",2013,F16D3,передний,1.6,-,60 000 км,Chevrolet,Самовывоз со склада
не задан,Усилитель переднего бампера для Chevrolet Cruze J300,2500.00₽,Cruze J300 2008-2014гг,"Седан, Хэтчбек, Универсал",2013,F16D3,передний,1.6,-,70 000 км,Chevrolet,Самовывоз со склада
не задан,Рулевая рейка для Chevrolet Cruze J300,10000.00₽,Cruze J300 2008-2014гг,"Седан, Хэтчбек, Универсал",2013,F16D3,передний,1.6,-,60 000 км,Chevrolet,Самовывоз со склада
288,Ступица задняя для Cruze J300 2012г.,1500.00₽,Cruze J300 2008-2014гг,"Седан, Хэтчбек, Универсал",2012,-,передний,-,-,-,Chevrolet,Самовывоз со склада
не задан,Задняя левая фара крышки багажника для Chevrolet Cruze J300,2000.00₽,Cruze J300 2008-2014гг,"Седан, Хэтчбек, Универсал",2011,-,передний,-,-,-,Chevrolet,Самовывоз со склада
не задан,Фара для Chevrolet Cruze J300,5000.00₽,Cruze J300 2008-2014гг,"Седан, Хэтчбек, Универсал",2013,F16D3,передний,1.6,-,70 000 км,Chevrolet,Самовывоз со склада
не задан,Главный тормозной цилиндр и вакуум для Chevrolet Cruze J300,8000.00₽,Cruze J300 2008-2014гг,"Седан, Хэтчбек, Универсал",2013,F16D3,передний,1.6,-,70 000 км,Chevrolet,Самовывоз со склада
не задан,Передний левый дверной замок для Chevrolet Cruze 2013г,2000.00₽,Cruze J300 2008-2014гг,"Седан, Хэтчбек, Универсал",2013,-,передний,-,-,-,Chevrolet,Самовывоз со склада
не задан,Тормозной вакуум для Chevrolet Cruze J300,4000.00₽,Cruze J300 2008-2014гг,"Седан, Хэтчбек, Универсал",2013,F16D3,передний,1.6,-,70 000 км,Chevrolet,Самовывоз со склада
не задан,Внутренняя декоративная рамка для Chevrolet Cruz J300 2013г,500.00₽,Cruze J300 2008-2014гг,"Седан, Хэтчбек, Универсал",2013,F16D3,передний,-,-,-,Chevrolet,Самовывоз со склада
не задан,Переднее левое стекло в дверь для Chevrolet Cruze 2013г,2500.00₽,Cruze J300 2008-2014гг,"Седан, Хэтчбек, Универсал",2013,-,передний,-,-,-,Chevrolet,Самовывоз со склада
не задан,Крышка багажника для Chevrolet Cruze J300,8000.00₽,Cruze J300 2008-2014гг,"Седан, Хэтчбек, Универсал",2011,-,передний,-,-,-,Chevrolet,Самовывоз со склада
не задан,Заднее левое стекло для Chevrolet Cruz J300 2013г,1000.00₽,Cruze J300 2008-2014гг,"Седан, Хэтчбек, Универсал",2013,F16D3,передний,-,-,-,Chevrolet,Самовывоз со склада
не задан,Задние пружины для Chevrolet Cruz J300 2013г,1000.00₽,Cruze J300 2008-2014гг,"Седан, Хэтчбек, Универсал",2013,F16D3,передний,-,-,-,Chevrolet,Самовывоз со склада
