Article,Name,Price,Model,Body,Year,EngineType,Transmission,Bulk,Capbility,Mileage,Mark,Category
не задан,Передняя стойка для Chevrolet Aveo T250 2010г,2000.00₽,Aveo Т250 2007-2011гг,"Седан, Хэтчбек",2010,B12S1,передний,-,-,93000,Chevrolet,Самовывоз со склада
не задан,Расширительный бочок для Chevrolet Aveo T250 2010г,1000.00₽,Aveo Т250 2007-2011гг,"Седан, Хэтчбек",2010,B12S1,передний,-,-,93000,Chevrolet,Самовывоз со склада
не задан,Решетка радиатора для Chevrolet Aveo T250 2010г,500.00₽,Aveo Т250 2007-2011гг,"Седан, Хэтчбек",2010,F14D4,передний,-,-,-,Chevrolet,Самовывоз со склада
не задан,Тормозной диск для Chevrolet Aveo T250 2010г,500.00₽,Aveo Т250 2007-2011гг,"Седан, Хэтчбек",2010,B12S1,передний,-,-,93000,Chevrolet,Самовывоз со склада
не задан,Насос гидроусилитель руля для Chevrolet Aveo T250 2010г,2500.00₽,Aveo Т250 2007-2011гг,"Седан, Хэтчбек",2010,B12S1,передний,-,-,93000,Chevrolet,Самовывоз со склада
не задан,Торпедо для Chevrolet Aveo T250 2010г,10000.00₽,Aveo Т250 2007-2011гг,"Седан, Хэтчбек",2010,F14D4,передний,-,-,-,Chevrolet,Самовывоз со склада
не задан,ЭБУ-блок управление мотором для Chevrolet Aveo T250 2010г,2500.00₽,Aveo Т250 2007-2011гг,"Седан, Хэтчбек",2010,B12S1,передний,-,-,93000,Chevrolet,Самовывоз со склада
не задан,Радиатор кондиционера для Chevrolet Aveo T250 2010г,2000.00₽,Aveo Т250 2007-2011гг,"Седан, Хэтчбек",2010,B12S1,передний,-,-,93000,Chevrolet,Самовывоз со склада
не задан,Трапеция дворников для Chevrolet Aveo T250 2010г,500.00₽,Aveo Т250 2007-2011гг,"Седан, Хэтчбек",2010,F14D4,передний,-,-,-,Chevrolet,Самовывоз со склада
не задан,Стартер для Chevrolet Aveo T250 2010г,3000.00₽,Aveo Т250 2007-2011гг,"Седан, Хэтчбек",2010,B12S1,передний,-,-,93000,Chevrolet,Самовывоз со склада
346,Обшивка двери передней левой для Aveo T250 2010г,1000.00₽,Aveo Т250 2007-2011гг,"Седан, Хэтчбек",2010,-,передний,-,-,-,Chevrolet,Самовывоз со склада
390,Фонарь задний правый для Aveo T250 2008г,2000.00₽,Aveo T250 2007-2011гг,Хэтчбек,2008,-,передний,-,-,-,Chevrolet,Самовывоз со склада
281,Двигатель для Chevrolet Niva I 2009-2015гг.,15000.00₽,Niva I 2009-2015гг,Внедорожник,2008,-,полный,1.7,-,140000,Chevrolet,Самовывоз со склада
330,Обшивка двери задней правой для Aveo T250 2010г,500.00₽,Aveo Т250 2007-2011гг,"Седан, Хэтчбек",2010,-,передний,-,-,-,Chevrolet,Самовывоз со склада
115,Дверь передняя левая для Rezzo 2000-2008гг,12000.00₽,Rezzo 2000-2008гг,Минивэн,2008,-,передний,-,-,180000 км,Chevrolet,Самовывоз со склада
744,Бак топливный для Aveo Т250,2500.00₽,Aveo Т250 2007-2011гг,"Седан, Хэтчбек",2008,-,передний,-,-,-,Chevrolet,Самовывоз со склада
99,Дверь передняя правая для Rezzo 2000-2008гг,12000.00₽,Rezzo 2000-2008гг,Минивэн,2008,-,передний,-,-,180 000 км,Chevrolet,Самовывоз со склада
не задан,Главный тормозной цилиндр и вакуум для Chevrolet Aveo T250 2010г,4000.00₽,Aveo Т250 2007-2011гг,"Седан, Хэтчбек",2010,F14D4,передний,-,-,-,Chevrolet,Самовывоз со склада
741,Глушитель основной для Aveo Т250,1000.00₽,Aveo Т250 2007-2011гг,"Седан, Хэтчбек",2006,-,передний,-,-,-,Chevrolet,Самовывоз со склада
106,Зеркало правое электрическое для Rezzo 2000-2008гг,2500.00₽,Rezzo 2000-2008гг,Минивэн,2008,-,передний,-,-,180 000 км,Chevrolet,Самовывоз со склада
116,Зеркало левое электрическое для Rezzo 2000-2008гг,2500.00₽,Rezzo 2000-2008гг,Минивэн,2008,-,передний,-,180 000 км,-,Chevrolet,Самовывоз со склада
не задан,Корпус отопителя для Aveo Т250,2000.00₽,Aveo Т250 2007-2011гг,"Седан, Хэтчбек",2011,-,передний,-,-,-,Chevrolet,Самовывоз со склада
571,Амортизатор передний правый для Aveo Т250 2008г,1500.00₽,Aveo Т250 2007-2011гг,"Седан, Хэтчбек",2008,-,передний,-,-,-,Chevrolet,Самовывоз со склада
не задан,Электро педаль для Chevrolet Aveo T250 2010г,2000.00₽,Aveo Т250 2007-2011гг,"Седан, Хэтчбек",2010,F14D4,передний,-,-,-,Chevrolet,Самовывоз со склада
96,Капот для Rezzo 2000-2008гг,12000.00₽,Rezzo 2000-2008гг,Минивэн,2008,-,передний,-,-,180 000 км,Chevrolet,Самовывоз со склада
126,Накладка переднего бампера под номер для Rezzo 2000-2008гг,500.00₽,Rezzo 2000-2008гг,Минивэн,2008,-,передний,-,-,180 000 км,Chevrolet,Самовывоз со склада
120,Наполнитель переднего бампера для Rezzo 2000-2008гг,500.00₽,Rezzo 2000-2008гг,Минивэн,2008,-,передний,-,-,180 000 км,Chevrolet,Самовывоз со склада
121,Локер передний левый для Rezzo 2000-2008гг,1000.00₽,Rezzo 2000-2008гг,Минивэн,2008,-,передний,-,-,180 000 км,Chevrolet,Самовывоз со склада
не задан,Блок управление печкой для Chevrolet Cruze J300,3000.00₽,Cruze J300 2008-2014гг,"Седан, Хэтчбек, Универсал",2013,-,передний,-,-,60 000 км,Chevrolet,Самовывоз со склада
101,Крыло заднее правое для Rezzo 2000-2008гг,10000.00₽,Rezzo 2000-2008гг,Минивэн,2008,-,передний,-,-,180 000 км,Chevrolet,Самовывоз со склада
не задан,Air bag подушка безопасности в руль для Chevrolet Cruze J300,6000.00₽,Cruze J300 2008-2014гг,"Седан, Хэтчбек, Универсал",2013,-,передний,-,-,-,Chevrolet,Самовывоз со склада
111,Крыло заднее левое для Rezzo 2000-2008гг,10000.00₽,Rezzo 2000-2008гг,Минивэн,2008,-,передний,-,-,180 000 км,Chevrolet,Самовывоз со склада
не задан,Вентилятор охлаждения (диффузор) для Chevrolet Cruze J300,5000.00₽,Cruze J300 2008-2014гг,"Седан, Хэтчбек, Универсал",2013,-,передний,-,-,60 000 км,Chevrolet,Самовывоз со склада
не задан,Генератор для Chevrolet Cruze J300,5000.00₽,Cruze J300 2008-2014гг,"Седан, Хэтчбек, Универсал",2013,F16D3,передний,-,-,60 000 км,Chevrolet,Самовывоз со склада
не задан,Бензонасос для Chevrolet Cruze J300,5000.00₽,Cruze J300 2008-2014гг,"Седан, Хэтчбек, Универсал",2013,-,передний,-,-,60 000 км,Chevrolet,Самовывоз со склада
не задан,Блок ABS тормозов для Chevrolet Cruze J300,6000.00₽,Cruze J300 2008-2014гг,"Седан, Хэтчбек, Универсал",2013,-,передний,-,-,-,Chevrolet,Самовывоз со склада
не задан,Вакуумный усилитель тормозов для Chevrolet Cruze J300,3000.00₽,Cruze J300 2008-2014гг,"Седан, Хэтчбек, Универсал",2013,-,передний,-,-,60 000 км,Chevrolet,Самовывоз со склада
не задан,Головка блока цилиндров для Chevrolet Cruze J300,20000.00₽,Cruze J300 2008-2014гг,"Седан, Хэтчбек, Универсал",2013,F16D3,передний,-,-,60 000 км,Chevrolet,Самовывоз со склада
не задан,Главный тормозной цилиндр для Chevrolet Cruze J300,4000.00₽,Cruze J300 2008-2014гг,"Седан, Хэтчбек, Универсал",2013,F16D3,передний,-,-,60 000 км,Chevrolet,Самовывоз со склада
не задан,Задняя пружина для Chevrolet Cruze J300,500.00₽,Cruze J300 2008-2014гг,"Седан, Хэтчбек, Универсал",2013,F16D3,передний,1.6,-,60 000 км,Chevrolet,Самовывоз со склада
не задан,Задний бампер для Chevrolet Cruze J300,8000.00₽,Cruze J300 2008-2014гг,"Седан, Хэтчбек, Универсал",2013,F16D3,передний,-,-,60 000 км,Chevrolet,Самовывоз со склада
не задан,"Впускной коллектор, дроссель, форсунки для Chevrolet Cruze J300",5000.00₽,Cruze J300 2008-2014гг,"Седан, Хэтчбек, Универсал",2013,F16D3,передний,-,-,60 000 км,Chevrolet,Самовывоз со склада
не задан,Задняя левая дверь в сборе для Chevrolet Cruze J300,25000.00₽,Cruze J300 2008-2014гг,"Седан, Хэтчбек, Универсал",2013,F16D3,передний,1.6,-,60 000 км,Chevrolet,Самовывоз со склада
не задан,Задний правый стоп сигнал для Chevrolet Cruze J300,5000.00₽,Cruze J300 2008-2014гг,"Седан, Хэтчбек, Универсал",2013,F16D3,передний,-,-,60 000 км,Chevrolet,Самовывоз со склада
не задан,Задний правый механический стеклоподъемник для Chevrolet Cruze J300,1000.00₽,Cruze J300 2008-2014гг,"Седан, Хэтчбек, Универсал",2013,F16D3,передний,-,-,60 000 км,Chevrolet,Самовывоз со склада
не задан,Задняя правая внутреняя декаративная рамка для Chevrolet Cruze J300,500.00₽,Cruze J300 2008-2014гг,"Седан, Хэтчбек, Универсал",2013,F16D3,передний,1.6,-,60 000 км,Chevrolet,Самовывоз со склада
не задан,Задняя правая дверь в сборе для Chevrolet Cruze J300,25000.00₽,Cruze J300 2008-2014гг,"Седан, Хэтчбек, Универсал",2013,F16D3,передний,1.6,-,60 000 км,Chevrolet,Самовывоз со склада
не задан,Задняя правая форточка для Chevrolet Cruze J300,500.00₽,Cruze J300 2008-2014гг,"Седан, Хэтчбек, Универсал",2013,F16D3,передний,1.6,-,60 000 км,Chevrolet,Самовывоз со склада
не задан,Задняя левая блок-ступица и тормозной суппорт для Chevrolet Cruze J300,2000.00₽,Cruze J300 2008-2014гг,"Седан, Хэтчбек, Универсал",2013,F16D3,передний,1.6,-,60 000 км,Chevrolet,Самовывоз со склада
не задан,Защита мотора для Chevrolet Cruze J300,2000.00₽,Cruze J300 2008-2014гг,"Седан, Хэтчбек, Универсал",2013,F16D3,передний,1.6,-,60 000 км,Chevrolet,Самовывоз со склада
не задан,Задний левый стоп сигнал для Chevrolet Cruze J300,5000.00₽,Cruze J300 2008-2014гг,"Седан, Хэтчбек, Универсал",2013,F16D3,передний,-,-,60 000 км,Chevrolet,Самовывоз со склада
не задан,Заднее правое стекло для Chevrolet Cruze J300,1500.00₽,Cruze J300 2008-2014гг,"Седан, Хэтчбек, Универсал",2013,F16D3,передний,-,-,60 000 км,Chevrolet,Самовывоз со склада
не задан,Задняя правая наружняя ручка двери для Chevrolet Cruze J300,1000.00₽,Cruze J300 2008-2014гг,"Седан, Хэтчбек, Универсал",2013,F16D3,передний,1.6,-,60 000 км,Chevrolet,Самовывоз со склада
117,Панель передняя для Rezzo 2000-2008гг,10000.00₽,Rezzo 2000-2008гг,Минивэн,2008,-,передний,-,-,180000 км,Chevrolet,Самовывоз со склада
143,Решетка радиатора для Rezzo 2000-2008гг,2000.00₽,Rezzo 2000-2008гг,Минивэн,2008,-,передний,-,-,180000 км,Chevrolet,Самовывоз со склада
не задан,"Задняя балка, суппорт, тормозные диски, ступицы для Chevrolet Cruze J300",25000.00₽,Cruze J300 2008-2014гг,"Седан, Хэтчбек, Универсал",2013,F16D3,передний,1.6,-,60 000 км,Chevrolet,Самовывоз со склада
128,Поводок стеклоочистителя передний правый для Rezzo 2000-2008гг,500.00₽,Rezzo 2000-2008гг,Минивэн,2008,-,передний,-,-,180 000 км,Chevrolet,Самовывоз со склада
137,Кронштейн двигателя правый для Rezzo 2000-2008гг,500.00₽,Rezzo 2000-2008гг,Минивэн,2008,-,передний,-,-,180 000 км,Chevrolet,Самовывоз со склада
не задан,Катализатор для Chevrolet Cruze J300,2000.00₽,Cruze J300 2008-2014гг,"Седан, Хэтчбек, Универсал",2013,F16D3,передний,1.6,-,60 000 км,Chevrolet,Самовывоз со склада
124,Радиатор кондиционера (конденсер) для Rezzo 2000-2008гг,3000.00₽,Rezzo 2000-2008гг,Минивэн,2008,-,передний,-,-,180 000 км,Chevrolet,Самовывоз со склада
132,Бачок расширительный для Rezzo 2000-2008гг,500.00₽,Rezzo 2000-2008гг,Минивэн,2008,-,передний,-,-,180000 км,Chevrolet,Самовывоз со склада
590,Головка блока для Spark M250 2005-2009гг,18000.00₽,Spark M250 2005-2009гг,Хэтчбек,2008,-,передний,-,-,-,Chevrolet,Самовывоз со склада
139,Бачок гидроусилителя для Rezzo 2000-2008гг,500.00₽,Rezzo 2000-2008гг,Минивэн,2008,-,передний,-,-,180000 км,Chevrolet,Самовывоз со склада
114,Стекло двери передней левой для Rezzo 2008г.,1500.00₽,Rezzo 2008г,Минивэн,2008,-,передний,-,-,180000,Chevrolet,Самовывоз со склада
112,Стекло двери задней левой для Rezzo 2008г,1500.00₽,Rezzo 2008г,Минивэн,2008,-,передний,-,-,180000,Chevrolet,Самовывоз со склада
104,Стекло двери задней правой для Rezzo 2008г.,1500.00₽,Rezzo 2008г,Минивэн,2008,-,передний,-,-,180000,Chevrolet,Самовывоз со склада
130,Решетка стеклооч. (планка под лобовое стекло) правая для Rezzo 2008г,500.00₽,Rezzo 2008г,Минивэн,2008,-,передний,-,-,180000,Chevrolet,Самовывоз со склада
102,Стекло кузовное глухое правое для Rezzo 2008г.,800.00₽,Rezzo 2008г,Минивэн,2008,-,передний,-,-,180000,Chevrolet,Самовывоз со склада
141,Трубка кондиционера для Rezzo 2008г.,1000.00₽,Rezzo 2008г,Минивэн,2008,-,передний,-,-,180000,Chevrolet,Самовывоз со склада
144,Шланг гидроусилителя для Rezzo 2008г.,200.00₽,Rezzo 2008г,Минивэн,2008,-,передний,-,-,180000,Chevrolet,Самовывоз со склада
129,Решетка стеклооч. (планка под лобовое стекло) левая для Rezzo 2008г,500.00₽,Rezzo 2008г,Минивэн,2008,-,передний,-,-,180000,Chevrolet,Самовывоз со склада
109,Фонарь задний левый для Rezzo 2008г.,2500.00₽,Rezzo 2008г,Минивэн,2008,-,передний,-,-,180000,Chevrolet,Самовывоз со склада
не задан,Насос кондиционера для Chevrolet Niva 2008г,3000.00₽,Niva I 2002-2008гг,Кроссовер,2008,-,полный,-,-,-,Chevrolet,Самовывоз со склада
105,Стекло двери передней правой для Rezzo 2008г.,1500.00₽,Rezzo 2008г,Минивэн,2008,-,передний,-,-,180000,Chevrolet,Самовывоз со склада
110,Стекло кузовное глухое левое для Rezzo 2018г.,800.00₽,Rezzo 2008г,Минивэн,2008,-,передний,-,-,180000,Chevrolet,Самовывоз со склада
не задан,Щиток приборов для Chevrolet Niva 2008г,1000.00₽,Niva I 2002-2008гг,Кроссовер,2008,-,полный,-,-,-,Chevrolet,Самовывоз со склада
не задан,Передняя правая дверь для Chevrolet Niva 2008г,6000.00₽,Niva I 2002-2008гг,Кроссовер,2008,-,полный,-,-,-,Chevrolet,Самовывоз со склада
не задан,Правая четверть кузова для Chevrolet Niva 2008г,2000.00₽,Niva I 2002-2008гг,Кроссовер,2008,-,полный,-,-,-,Chevrolet,Самовывоз со склада
496,Форсунка инжекторная электрическая для Niva I 2002-2008гг,500.00₽,Niva I 2002-2008гг,Внедорожник,2008,-,передний,-,-,-,Chevrolet,Самовывоз со склада
не задан,ЭБУ-блок управление мотором для Chevrolet Niva 2008г,3000.00₽,Niva I 2002-2008гг,Кроссовер,2008,-,полный,-,-,-,Chevrolet,Самовывоз со склада
не задан,Моторчик печки для Chevrolet Niva 2008г,1000.00₽,Niva I 2002-2008гг,Кроссовер,2008,-,полный,-,-,-,Chevrolet,Самовывоз со склада
277,Абсорбер (фильтр угольный) для Niva I 2002-2008гг,500.00₽,Niva I 2002-2008гг,Внедорожник,2008,-,�4wd,-,-,80000 км,Chevrolet,Самовывоз со склада
268,Корпус воздушного фильтра для Niva I 2002-2008гг,1000.00₽,Niva I 2002-2008гг,Внедорожник,2008,-,�4wd,1.7,-,80000 км,Chevrolet,Самовывоз со склада
282,Насос гидроусилителя для Niva I 2002-2008гг,2000.00₽,Niva I 2002-2008гг,-,2008,-,�4wd,1.7,-,80000 км,Chevrolet,Самовывоз со склада
450,Фара противотуманная для Niva I 2002-2008гг,200.00₽,Niva I 2002-2008гг,Внедорожник,2008,-,передний,-,-,-,Chevrolet,Самовывоз со склада
284,Диск сцепления для Niva I 2002-2008гг,500.00₽,Niva I 2002-2008гг,Внедорожник,2008,-,�4wd,1.7,-,80000 км,Chevrolet,Самовывоз со склада
274,Радиатор основной для Niva I 2002-2008гг,1000.00₽,Niva I 2002-2008гг,Внедорожник,2008,-,�4wd,-,-,80000 км,Chevrolet,Самовывоз со склада
283,Корзина сцепления для Niva I 2002-2008гг,500.00₽,Niva I 2002-2008гг,Внедорожник,2008,-,�4wd,1.7,-,80000 км,Chevrolet,Самовывоз со склада
275,Генератор для Niva I 2002-2008гг,2000.00₽,Niva I 2002-2008гг,Внедорожник,2008,-,�4wd,1.7,-,80000 км,Chevrolet,Самовывоз со склада
289,Катушка зажигания для Niva I 2002-2008гг,500.00₽,Niva I 2002-2008гг,Внедорожник,2008,-,�4wd,1.7,-,80000 км,Chevrolet,Самовывоз со склада
286,Вал карданный для Niva I 2002-2008гг,1500.00₽,Niva I 2002-2008гг,-,2008,-,�4wd,1.7,-,80000 км,Chevrolet,Самовывоз со склада
276,Стартер для Niva I 2002-2008гг,1500.00₽,Niva I 2002-2008гг,Внедорожник,2008,-,полный,1.7,-,80000 км,Chevrolet,Самовывоз со склада
531,Моторчик отопителя для Chevrolet Niva I 2002-2008гг.,500.00₽,Niva I 2002-2008гг,Внедорожник,2008,-,передний,-,-,-,Chevrolet,Самовывоз со склада
468,Насос топливный электрический для Niva I 2002-2008гг,1000.00₽,Niva I 2002-2008гг,Внедорожник,2008,-,передний,-,-,-,Chevrolet,Самовывоз со склада
271,Бачок расширительный для Niva I 2002-2008гг,300.00₽,Niva I 2002-2008гг,Внедорожник,2008,-,�4wd,-,-,80000 км,Chevrolet,Самовывоз со склада
285,Вал карданный передний  для Niva I 2002-2008гг,1500.00₽,Niva I 2002-2008гг,Внедорожник,2008,-,передний,1.7,-,80000 км,Chevrolet,Самовывоз со склада
272,Накладка декоративная для Niva I 2002-2008гг,1000.00₽,Niva I 2002-2008гг,Внедорожник,2008,-,�4wd,1.7,-,80000 км,Chevrolet,Самовывоз со склада
527,Моторчик отопителя для Chevrolet Niva I 2008г.,500.00₽,Niva I 2002-2008гг.,Внедорожник,2008,-,передний,-,-,-,Chevrolet,Самовывоз со склада
273,Ступица передняя для Niva I 2002-2008гг,500.00₽,Niva I 2002-2008гг,Внедорожник,2008,-,�4wd,-,-,80000 км,Chevrolet,Самовывоз со склада
не задан,Передний правый рычаг для Chevrolet Lanos FSO 2008г,1500.00₽,Lanos FSO 2004-2008гг,"Седан, Хэтчбек",2008,A15SMS,передний,-,-,-,Chevrolet,Самовывоз со склада
не задан,Передняя правая черная дверь для Chevrolet Lanos FSO 2008г,1000.00₽,Lanos FSO 2004-2008гг,"Седан, Хэтчбек",2008,A15SMS,передний,-,-,-,Chevrolet,Самовывоз со склада
не задан,Передняя правая синяя дверь для Chevrolet Lanos FSO 2008г,3000.00₽,Lanos FSO 2004-2008гг,"Седан, Хэтчбек",2008,A15SMS,передний,-,-,-,Chevrolet,Самовывоз со склада
не задан,Передняя правая серебряная дверь для Chevrolet Lanos FSO 2008г,4000.00₽,Lanos FSO 2004-2008гг,"Седан, Хэтчбек",2008,A15SMS,передний,-,-,-,Chevrolet,Самовывоз со склада
501,Форсунки инжекторные электрические для Chevrolet Niva I 2002-2008гг.,2000.00₽,Chevrolet Niva I 2002-2008гг.,Внедорожник,2008,-,передний,-,-,-,Chevrolet,Самовывоз со склада
не задан,Передняя правая серая дверь для Chevrolet Lanos FSO 2008г,4000.00₽,Lanos FSO 2004-2008гг,"Седан, Хэтчбек",2008,A15SMS,передний,-,-,-,Chevrolet,Самовывоз со склада
310,Обшивка двери задней правой для Lanos FSO 2004-2008гг,500.00₽,Lanos FSO 2004-2008гг,"Седан, Хэтчбек",2008,-,передний,-,-,-,Chevrolet,Самовывоз со склада
не задан,Передняя правая стойка для Chevrolet Lanos FSO 2008г,2500.00₽,Lanos FSO 2004-2008гг,"Седан, Хэтчбек",2008,A15SMS,передний,-,-,82000,Chevrolet,Самовывоз со склада
307,Обшивка двери передней правой для Lanos FSO 2004-2008гг,500.00₽,Lanos FSO 2004-2008гг,"Седан, Хэтчбек",2008,-,передний,-,-,-,Chevrolet,Самовывоз со склада
305,Обшивка двери задней левой для Lanos FSO 2004-2008гг,500.00₽,Lanos FSO 2004-2008гг,"Седан, Хэтчбек",2008,-,передний,-,-,-,Chevrolet,Самовывоз со склада
715,МКПП для Lanos FSO 2004-2008гг,8000.00₽,Lanos FSO 2004-2008гг,"Седан, Хэтчбек",2008,-,передний,-,-,-,Chevrolet,Самовывоз со склада
487,Форсунка инжекторная электрическая для Lanos FSO 2004-2008гг,500.00₽,Lanos FSO 2004-2008гг,"Седан, Хэтчбек",2008,-,передний,-,-,-,Chevrolet,Самовывоз со склада
392,Фонарь задний правый для Lanos FSO 2004-2008гг,1000.00₽,Lanos FSO 2004-2008гг,"Седан, Хэтчбек",2008,-,передний,-,-,-,Chevrolet,Самовывоз со склада
524,Моторчик отопителя для Chevrolet Lanos FSO 2004-2008гг.,1500.00₽,Chevrolet Lanos FSO 2004-2008гг.,"Седан, Хэтчбек",2008,-,передний,-,-,-,Chevrolet,Самовывоз со склада
434,Фара противотуманная правая для Lanos FSO 2004-2008гг,200.00₽,Lanos FSO 2004-2008гг,"Седан, Хэтчбек",2008,-,передний,-,-,-,Chevrolet,Самовывоз со склада
