Article,Name,Price,Model,Body,Year,EngineType,Transmission,Bulk,Capbility,Mileage,Mark,Category
не задан,Левая накладка порога для Daewoo Matiz M200 2008г,500.00₽,Matiz M200 2005-2010гг,Хэтчбек,2008,B10S1,передний,-,-,-,Daewoo,Самовывоз со склада
не задан,Заднее левое стекло для Chevrolet Lanos FSO 2008г,500.00₽,Lanos FSO 2004-2008гг,"Седан, Хэтчбек",2008,A15SMS,передний,-,-,-,Chevrolet,Самовывоз со склада
не задан,Задняя правая дверь для Chevrolet Lanos FSO 2008г,4000.00₽,Lanos FSO 2004-2008гг,"Седан, Хэтчбек",2008,A15SMS,передний,-,-,-,Chevrolet,Самовывоз со склада
не задан,Тормозной вакуум для Chevrolet Lanos FSO,1000.00₽,Lanos FSO 2004-2008гг,"Седан, Хэтчбек",2010,A15SMS,передний,1.6,-,40 000 км,Chevrolet,Самовывоз со склада
не задан,Задняя левая дверь для Chevrolet Lanos FSO 2008г,4000.00₽,Lanos FSO 2004-2008гг,"Седан, Хэтчбек",2008,A15SMS,передний,-,-,-,Chevrolet,Самовывоз со склада
не задан,Радиатор печки для Chevrolet Lanos FSO,1000.00₽,Lanos FSO 2004-2008гг,"Седан, Хэтчбек",2007,-,передний,-,-,-,Chevrolet,Самовывоз со склада
не задан,Передний правый механический стеклоподъемник для Chevrolet Lanos FSO 2008г,500.00₽,Lanos FSO 2004-2008гг,"Седан, Хэтчбек",2008,A15SMS,передний,-,-,-,Chevrolet,Самовывоз со склада
не задан,Бензонасос для Chevrolet Lanos FSO 2008г,2000.00₽,Lanos FSO 2004-2008гг,"Седан, Хэтчбек",2008,A15SMS,передний,-,-,82000,Chevrolet,Самовывоз со склада
не задан,Задний правый стоп сигнал для Chevrolet Lanos FSO,1000.00₽,Lanos FSO 2004-2008гг,"Седан, Хэтчбек",2006,-,передний,-,-,-,Chevrolet,Самовывоз со склада
не задан,Передний левый рычаг для Chevrolet Lanos FSO 2008г,1500.00₽,Lanos FSO 2004-2008гг,"Седан, Хэтчбек",2008,A15SMS,передний,-,-,-,Chevrolet,Самовывоз со склада
не задан,Передний правый суппорт для Daewoo Matiz M200 2008г,500.00₽,Matiz M200 2005-2010гг,Хэтчбек,2008,B10S1,передний,-,-,69000,Daewoo,Самовывоз со склада
не задан,Передняя левая накладка крыла для Daewoo Matiz M200 2008г,200.00₽,Matiz M200 2005-2010гг,Хэтчбек,2008,B10S1,передний,-,-,-,Daewoo,Самовывоз со склада
не задан,Передняя левая накладка двери для Daewoo Matiz M200 2008г,500.00₽,Matiz M200 2005-2010гг,Хэтчбек,2008,B10S1,передний,-,-,-,Daewoo,Самовывоз со склада
не задан,Передняя левая форточка для Daewoo Matiz M200 2008г,300.00₽,Matiz M200 2005-2010гг,Хэтчбек,2008,B10S1,передний,-,-,-,Daewoo,Самовывоз со склада
не задан,Передняя правая накладка крыла для Daewoo Matiz M200 2008г,200.00₽,Matiz M200 2005-2010гг,Хэтчбек,2008,B10S1,передний,-,-,-,Daewoo,Самовывоз со склада
не задан,Правый порог для Daewoo Matiz M200 2008г,3000.00₽,Matiz M200 2005-2010гг,Хэтчбек,2008,B10S1,передний,-,-,-,Daewoo,Самовывоз со склада
не задан,Передняя правая накладка двери для Daewoo Matiz M200 2008г,500.00₽,Matiz M200 2005-2010гг,Хэтчбек,2008,B10S1,передний,-,-,-,Daewoo,Самовывоз со склада
не задан,Правая накладка порога для Daewoo Matiz M200 2008г,500.00₽,Matiz M200 2005-2010гг,Хэтчбек,2008,B10S1,передний,-,-,-,Daewoo,Самовывоз со склада
не задан,Расширительный бочок для Daewoo Matiz M200 2008г,500.00₽,Matiz M200 2005-2010гг,Хэтчбек,2008,B10S1,передний,-,-,-,Daewoo,Самовывоз со склада
не задан,Передний правый датчик ABS для Daewoo Matiz M200 2008г,500.00₽,Matiz M200 2005-2010гг,Хэтчбек,2008,B10S1,передний,-,-,69000,Daewoo,Самовывоз со склада
228,Двигатель для Lacetti J200 2002-2014гг,38000.00₽,Lacetti J200 2002-2014гг,Седан,2008,F16D3,�,1.6,Nexia II 2009-2016гг,130000,Chevrolet,Самовывоз со склада
не задан,Заднее правое стекло для Chevrolet Spark M250 2007г,1000.00₽,Spark M300 2009-2015гг,Хэтчбек,2007,-,передний,-,-,-,Chevrolet,Самовывоз со склада
252,Корпус воздушного фильтра для Lacetti J200 2002-2014гг,1000.00₽,Lacetti J200 2002-2014гг,Седан,2008,F16D3,�,1.6,-,80000 км,Chevrolet,Самовывоз со склада
353,Обшивка двери задней левой для Lacetti J200 2006г.,500.00₽,Lacetti J200 2002-2014гг,Седан,2006,-,передний,-,-,-,Chevrolet,Самовывоз со склада
301,Замок двери передней левой для Lacetti J200 2002-2014гг,1000.00₽,Lacetti J200 2002-2014гг,Седан,2008,F16D3,�,1.6,-,115 000 км,Chevrolet,Самовывоз со склада
233,Бачок омывателя лобового стекла для Lacetti J200 2002-2014гг,1000.00₽,Lacetti J200 2002-2014гг,Седан,2008,F16D3,�,1.6,-,80000 км,Chevrolet,Самовывоз со склада
не задан,Передняя правая фара для Daewoo Matiz M200 2008г,1000.00₽,Matiz M200 2005-2010гг,Хэтчбек,2008,B10S1,передний,-,-,-,Daewoo,Самовывоз со склада
336,Обшивка двери задней правой для Lacetti J200 2002-2014гг,500.00₽,Lacetti J200 2002-2014гг,Седан,2008,-,передний,-,-,-,Chevrolet,Самовывоз со склада
597,Радиатор отопителя для Lacetti J200 2002-2014гг,1500.00₽,Lacetti J200 2002-2014гг,Седан,2008,-,передний,-,-,-,Chevrolet,Самовывоз со склада
603,Трапеция стеклоочистителей для Lacetti J200 2002-2014гг,2000.00₽,Lacetti J200 2002-2014гг,Седан,2008,-,передний,-,-,-,Chevrolet,Самовывоз со склада
214,Бампер передний для Lacetti J200 2002-2014гг,2000.00₽,Lacetti J200 2002-2014гг,Седан,2008,F16D3,передний,1.6,-,180000,Chevrolet,Самовывоз со склада
216,Локер передний левый для Lacetti J200 2002-2014гг,1000.00₽,Lacetti J200 2002-2014гг,Седан,2008,F16D3,передний,1.6,-,180000,Chevrolet,Самовывоз со склада
212,Крыло переднее правое седан для Lacetti J200 2002-2014гг,500.00₽,Lacetti J200 2002-2014гг,Седан,2008,F16D3,передний,1.6,-,180000,Chevrolet,Самовывоз со склада
445,Фара противотуманная правая для Lacetti J200 2002-2014гг,500.00₽,Lacetti J200 2002-2014гг,Седан,2008,-,передний,-,-,-,Chevrolet,Самовывоз со склада
не задан,Главный тормозной цилиндр для Chevrolet Spark M250,1500.00₽,Spark M300 2009-2015гг,Хэтчбек,2007,A15SMS,передний,1.6,-,60 000 км,Chevrolet,Самовывоз со склада
224,Решетка радиатора для Lacetti J200 2002-2014гг,1500.00₽,Lacetti J200 2002-2014гг,"Седан, Универсал",2008,F16D3,передний,1.6,-,80000 км,Chevrolet,Самовывоз со склада
211,Фара правая для Lacetti J200 2002-2014гг,2000.00₽,Lacetti J200 2002-2014гг,"Седан, Универсал",2008,F16D3,передний,1.6,-,180000,Chevrolet,Самовывоз со склада
210,Фара левая для Lacetti J200 2002-2014гг,1000.00₽,Lacetti J200 2002-2014гг,"Седан, Универсал",2008,F16D3,передний,1.6,-,180000,Chevrolet,Самовывоз со склада
208,Фонарь задний левый для Lacetti J200 2002-2014гг,2500.00₽,Lacetti J200 2002-2014гг,Седан,2008,F16D3,передний,1.6,-,180000,Chevrolet,Самовывоз со склада
596,Обшивка потолка для Lacetti J200 2002-2014гг,1500.00₽,Lacetti J200 2002-2014гг,Седан,2008,-,передний,-,-,-,Chevrolet,Самовывоз со склада
639,Кулак поворотный передний левый для Lacetti J200 2002-2014гг,2500.00₽,Lacetti J200 2002-2014гг,Седан,2008,-,передний,-,-,-,Chevrolet,Самовывоз со склада
209,Фонарь задний правый для Lacetti J200 2002-2014гг,1000.00₽,Lacetti J200 2002-2014гг,Седан,2008,F16D3,передний,1.6,-,180000,Chevrolet,Самовывоз со склада
227,Опора двигателя задняя для Lacetti J200 2002-2014гг,500.00₽,Lacetti J200 2002-2014гг,Седан,2008,F16D3,�,1.6,-,180000,Chevrolet,Самовывоз со склада
232,Бачок гидроусилителя для Lacetti J200 2002-2014гг,1000.00₽,Lacetti J200 2002-2014гг,Седан,2008,F16D3,�,1.6,-,80000 км,Chevrolet,Самовывоз со склада
221,Глушитель основной для Lacetti J200 2002-2014гг,1500.00₽,Lacetti J200 2002-2014гг,Седан,2008,F16D3,�,1.6,-,115 000 км,Chevrolet,Самовывоз со склада
262,Компрессор системы кондиционирования для Lacetti J200 2002-2014гг,6000.00₽,Lacetti J200 2002-2014гг,Седан,2008,F16D3,�,1.6,-,80000 км,Chevrolet,Самовывоз со склада
599,Пружина передняя для Lacetti J200 2002-2014гг,500.00₽,Lacetti J200 2002-2014гг,Седан,2008,-,передний,-,-,-,Chevrolet,Самовывоз со склада
704,Амортизатор передний правый для Lacetti J200 2007г.,1500.00₽,Lacetti J200 2002-2014гг,Седан,2007,-,передний,-,-,-,Chevrolet,Самовывоз со склада
226,Трубка кондиционера для Lacetti J200 2002-2014гг,500.00₽,Lacetti J200 2002-2014гг,Седан,2008,F16D3,�,1.6,-,80000 км,Chevrolet,Самовывоз со склада
не задан,Задний бампер для Chevrolet Spark M250 2007г,3000.00₽,Spark M300 2009-2015гг,Хэтчбек,2007,-,передний,-,-,-,Chevrolet,Самовывоз со склада
225,Средняя часть глушителя для Lacetti J200 2002-2014гг,1000.00₽,Lacetti J200 2002-2014гг,Седан,2008,F16D3,�,1.6,-,115 000 км,Chevrolet,Самовывоз со склада
215,Локер передний правый для Lacetti J200 2002-2014гг,1000.00₽,Lacetti J200 2002-2014гг,Седан,2008,F16D3,передний,1.6,-,180000,Chevrolet,Самовывоз со склада
не задан,Задний правый механический стеклоподъемник для Chevrolet Spark M250 2007г,500.00₽,Spark M300 2009-2015гг,Хэтчбек,2007,-,передний,-,-,-,Chevrolet,Самовывоз со склада
не задан,Задняя правая наружная ручка двери для Chevrolet Spark M250 2007г,500.00₽,Spark M300 2009-2015гг,Хэтчбек,2007,-,передний,-,-,-,Chevrolet,Самовывоз со склада
231,Бачок расширительный для Lacetti J200 2002-2014гг,500.00₽,Lacetti J200 2002-2014гг,Седан,2008,F16D3,�,1.6,-,80000 км,Chevrolet,Самовывоз со склада
261,Радиатор кондиционера (конденсер) для Lacetti J200 2002-2014гг,1000.00₽,Lacetti J200 2002-2014гг,Седан,2008,F16D3,�,1.6,-,180000 км,Chevrolet,Самовывоз со склада
408,Фонарь задний левый для Spark M250 2005-2009гг,2000.00₽,Spark M250 2005-2009гг,Хэтчбек,2008,-,передний,-,-,-,Chevrolet,Самовывоз со склада
328,Обшивка двери задней правой для Spark M250 2005-2009гг,500.00₽,Spark M250 2005-2009гг,Хэтчбек,2008,-,передний,-,-,-,Chevrolet,Самовывоз со склада
не задан,Задний правый замок двери для Chevrolet Spark M250 2007г,500.00₽,Spark M300 2009-2015гг,Хэтчбек,2007,-,передний,-,-,-,Chevrolet,Самовывоз со склада
463,Насос топливный электрический для Spark M250 2005-2009гг,2000.00₽,Spark M250 2005-2009гг,Хэтчбек,2008,-,передний,-,-,-,Chevrolet,Самовывоз со склада
517,Моторчик отопителя для Chevrolet Spark M250 2005-2009гг.,2500.00₽,Spark M250 2005-2009гг,Хэтчбек,2008,-,передний,-,-,-,Chevrolet,Самовывоз со склада
не задан,Задняя правая обшивка салона для Chevrolet Spark M250 2007г,500.00₽,Spark M300 2009-2015гг,Хэтчбек,2007,-,передний,-,-,-,Chevrolet,Самовывоз со склада
326,Обшивка двери передней правой для Spark M250 2005-2009гг,500.00₽,Spark M250 2005-2009гг,Хэтчбек,2008,-,передний,-,-,-,Chevrolet,Самовывоз со склада
не задан,Правое зеркало заднего вида для Daewoo Nexia,1000.00₽,Nexia II 2009-2016гг,Седан,2007,A15MF,передний,1.6,-,60 00 км,Daewoo,Самовывоз со склада
не задан,Двигатель ДВС для Daewoo Nexia,25000.00₽,Nexia II 2009-2016гг,Седан,2013,A15SMS,передний,1.6,-,120 000 км,Daewoo,Самовывоз со склада
не задан,Передний левый механический стеклоподъемник для Daewoo Nexia,1000.00₽,Nexia II 2009-2016гг,Седан,2013,A15SMS,передний,1.6,-,60 00 км,Daewoo,Самовывоз со склада
не задан,Задний правый стоп сигнал для Chevrolet Sens,500.00₽,Sens L-1300 2002-2016,"Седан, Хэтчбек",2005,A15SMS,передний,1.6,-,60 000 км,Chevrolet,Самовывоз со склада
не задан,Передний правый механический стеклоподъемник для Daewoo Nexia II,500.00₽,Nexia II 2009-2016гг,Седан,2013,A15SMS,передний,1.6,-,60 00 км,Daewoo,Самовывоз со склада
не задан,Корзина сцепления для Daewoo Nexia,1000.00₽,Nexia II 2009-2016гг,Седан,2007,A15SMS,передний,1.6,-,60 00 км,Daewoo,Самовывоз со склада
не задан,Передний тормозной диск для Daewoo Nexia,500.00₽,Nexia II 2009-2016гг,Седан,2012,A15SMS,передний,1.6,-,60 000 км,Daewoo,Самовывоз со склада
не задан,Бензонасос высокого давления для Daewoo Matiz KLYA,1500.00₽,Matiz M200 2005-2010гг,Хэтчбек,2007,A15SMS,передний,1.6,-,63 000 км,Daewoo,Самовывоз со склада
не задан,Дроссель для Daewoo Matiz KLYA,2000.00₽,Matiz M200 2005-2010гг,Хэтчбек,2007,B10S1,передний,1.6,-,63 000 км,Daewoo,Самовывоз со склада
не задан,"Механизм стеклоочистителя, мотор дворников для Daewoo Nexia",1000.00₽,Nexia II 2009-2016гг,Седан,2007,A15SMS,передний,1.6,-,60 00 км,Daewoo,Самовывоз со склада
не задан,Задний правый фонарь для Daewoo Matiz KLYA,500.00₽,Matiz M200 2005-2010гг,Хэтчбек,2007,B10S1,передний,1.6,-,63 000 км,Daewoo,Самовывоз со склада
не задан,Задняя ступица для Daewoo Matiz KLYA,500.00₽,Matiz M200 2005-2010гг,Хэтчбек,2007,B10S1,передний,1.6,-,63 000 км,Daewoo,Самовывоз со склада
не задан,Зеркало заднего вида левое для Daewoo Matiz KLYA,1000.00₽,Matiz M200 2005-2010гг,Хэтчбек,2007,B10S1,передний,1.6,-,63 000 км,Daewoo,Самовывоз со склада
не задан,"Передний левый привод, граната наружная  для Daewoo Matiz KLYA",1500.00₽,Matiz M200 2005-2010гг,Хэтчбек,2007,B10S1,передний,1.6,-,63 000 км,Daewoo,Самовывоз со склада
не задан,Передний правый привод в сборе для Daewoo Matiz KLYA,1500.00₽,Matiz M200 2005-2010гг,Хэтчбек,2007,B10S1,передний,1.6,-,63 000 км,Daewoo,Самовывоз со склада
не задан,Передний левый кулак в сборе для Daewoo Nexia,5000.00₽,Nexia II 2009-2016гг,Седан,2013,A15SMS,передний,1.6,-,60 000 км,Daewoo,Самовывоз со склада
не задан,Задняя балка для Daewoo Matiz KLYA,5000.00₽,Matiz M200 2005-2010гг,Хэтчбек,2007,B10S1,передний,1.6,-,63 000 км,Daewoo,Самовывоз со склада
не задан,Задняя пружина для Daewoo Matiz KLYA,500.00₽,Matiz M200 2005-2010гг,Хэтчбек,2007,B10S1,передний,1.6,-,63 000 км,Daewoo,Самовывоз со склада
не задан,Передняя правая стойка в сборе для Daewoo Matiz KLYA,3000.00₽,Matiz M200 2005-2010гг,Хэтчбек,2007,B10S1,передний,1.6,-,63 000 км,Daewoo,Самовывоз со склада
не задан,Правое зеркало заднего вида для Daewoo Matiz KLYA,1000.00₽,Matiz M200 2005-2010гг,Хэтчбек,2007,B10S1,передний,1.6,-,63 000 км,Daewoo,Самовывоз со склада
не задан,Передняя левая стойка в сборе для Daewoo Matiz KLYA,3000.00₽,Matiz M200 2005-2010гг,Хэтчбек,2007,B10S1,передний,1.6,-,63 000 км,Daewoo,Самовывоз со склада
не задан,Механическая коробка передач (мкпп) для Daewoo Nexia,7000.00₽,Nexia II 2009-2016гг,Седан,2013,A15SMS,передний,1.6,-,60 00 км,Daewoo,Самовывоз со склада
не задан,Главный тормозной цилиндр и вакуум для Daewoo Matiz KLYA,2500.00₽,Matiz M200 2005-2010гг,Хэтчбек,2007,B10S1,передний,1.6,-,63 000 км,Daewoo,Самовывоз со склада
не задан,Передний правый суппорт для Daewoo Matiz KLYA,500.00₽,Matiz M200 2005-2010гг,Хэтчбек,2007,B10S1,передний,1.6,-,63 000 км,Daewoo,Самовывоз со склада
не задан,Топливные форсунки и рампа для Daewoo Matiz KLYA,1500.00₽,Matiz M200 2005-2010гг,Хэтчбек,2007,B10S1,передний,1.6,-,63 000 км,Daewoo,Самовывоз со склада
не задан,Блок управления печкой для Daewoo Matiz 2008г,500.00₽,Matiz M200 2005-2010гг,Хэтчбек,2008,B10S1,передний,-,-,-,Daewoo,Самовывоз со склада
не задан,Тормозной вакуум для Daewoo Matiz KLYA,1000.00₽,Matiz M200 2005-2010гг,Хэтчбек,2007,B10S1,передний,1.6,-,63 000 км,Daewoo,Самовывоз со склада
не задан,Фара передняя левая для Daewoo Matiz KLYA,1000.00₽,Matiz M200 2005-2010гг,Хэтчбек,2007,B10S1,передний,1.6,-,63 000 км,Daewoo,Самовывоз со склада
не задан,Генератор для Daewoo Matiz 2008г,3000.00₽,Matiz M200 2005-2010гг,Хэтчбек,2008,B10S1,передний,-,-,-,Daewoo,Самовывоз со склада
не задан,Рулевая рейка механическая для Daewoo Matiz KLYA,1000.00₽,Matiz M200 2005-2010гг,Хэтчбек,2007,B10S1,передний,1.6,-,63 000 км,Daewoo,Самовывоз со склада
не задан,Задний амортизатор для Daewoo Matiz 2008г,300.00₽,Matiz M200 2005-2010гг,Хэтчбек,2008,B10S1,передний,-,-,-,Daewoo,Самовывоз со склада
не задан,Передний левый привод для Daewoo Matiz 2008г,1500.00₽,Matiz M200 2005-2010гг,Хэтчбек,2008,B10S1,передний,-,-,-,Daewoo,Самовывоз со склада
не задан,Механическая коробка передач для Daewoo Matiz 2008г,6000.00₽,Matiz M200 2005-2010гг,Хэтчбек,2008,B10S1,передний,-,-,-,Daewoo,Самовывоз со склада
не задан,Подушка безопасности AIR-BAG  в руль для Daewoo Matiz 2008г,1000.00₽,Matiz M200 2005-2010гг,Хэтчбек,2008,B10S1,передний,-,-,-,Daewoo,Самовывоз со склада
не задан,Передняя левая цапфа (кулак) для Daewoo Matiz 2008г,1000.00₽,Matiz M200 2005-2010гг,Хэтчбек,2008,B10S1,передний,-,-,-,Daewoo,Самовывоз со склада
не задан,Фара передняя правая для Daewoo Matiz KLYA,1000.00₽,Matiz M200 2005-2010гг,Хэтчбек,2007,B10S1,передний,1.6,-,63 000 км,Daewoo,Самовывоз со склада
не задан,Передний правый суппорт для Daewoo Matiz 2008г,500.00₽,Matiz M200 2005-2010гг,Хэтчбек,2008,B10S1,передний,-,-,-,Daewoo,Самовывоз со склада
не задан,Передняя балка подвески для Daewoo Matiz 2008г,2000.00₽,Matiz M200 2005-2010гг,Хэтчбек,2008,B10S1,передний,-,-,-,Daewoo,Самовывоз со склада
не задан,"Задняя левая цапфа (кулак), ступица для Chevrolet Lacetti J200",2500.00₽,Lacetti J200 2002-2014гг,"Седан, Хэтчбек, Универсал",2009,F16D3,передний,1.6,-,85 000 км,Chevrolet,Самовывоз со склада
не задан,Задний правый суппорт для Chevrolet Lacceti J200,1500.00₽,Lacetti J200 2002-2014гг,"Седан, Хэтчбек, Универсал",2009,F16D3,передний,1.6,-,85 000 км,Chevrolet,Самовывоз со склада
не задан,Бензонасос для Chevrolet Lacetti J200,2500.00₽,Lacetti J200 2002-2014гг,"Седан, Хэтчбек, Универсал",2013,F16D3,передний,1.6,-,85 000 км,Chevrolet,Самовывоз со склада
не задан,Задний тормозной диск для Chevrolet Lacetti J200,500.00₽,Lacetti J200 2002-2014гг,"Седан, Хэтчбек, Универсал",2009,F16D3,передний,1.6,-,85 000 км,Chevrolet,Самовывоз со склада
не задан,Корпус печки для Daewoo Matiz 2008г,1000.00₽,Matiz M200 2005-2010гг,Хэтчбек,2008,B10S1,передний,-,-,-,Daewoo,Самовывоз со склада
не задан,Задняя правая стойка для Chevrolet Lacetti J200,2000.00₽,Lacetti J200 2002-2014гг,"Седан, Хэтчбек, Универсал",2009,F16D3,передний,1.6,-,85 000 км,Chevrolet,Самовывоз со склада
не задан,Передний правый суппорт для Chevrolet Lacceti J200,1000.00₽,Lacetti J200 2002-2014гг,"Седан, Хэтчбек, Универсал",2010,F16D3,передний,1.6,-,85 000 км,Chevrolet,Самовывоз со склада
не задан,Передний тормозной диск для Chevrolet Lacceti J200,500.00₽,Lacetti J200 2002-2014гг,"Седан, Хэтчбек, Универсал",2009,F16D3,передний,1.6,-,85 000 км,Chevrolet,Самовывоз со склада
не задан,Передний левый суппорт для Chevrolet Lacceti J200,1000.00₽,Lacetti J200 2002-2014гг,"Седан, Хэтчбек, Универсал",2009,F16D3,передний,1.6,-,85 000 км,Chevrolet,Самовывоз со склада
не задан,Задний левый стоп сигнал для Chevrolet Lacetti J200,1000.00₽,Lacetti J200 2002-2014гг,"Седан, Хэтчбек, Универсал",2010,F16D3,передний,1.6,-,85 000 км,Chevrolet,Самовывоз со склада
не задан,"Задняя правая цапфа (кулак), ступица для Chevrolet Lacetti J200",2500.00₽,Lacetti J200 2002-2014гг,"Седан, Хэтчбек, Универсал",2009,F16D3,передний,1.6,-,85 000 км,Chevrolet,Самовывоз со склада
не задан,Передняя пружина для Chevrolet Lacceti J200,500.00₽,Lacetti J200 2002-2014гг,"Седан, Хэтчбек, Универсал",2010,F16D3,передний,1.6,-,85 000 км,Chevrolet,Самовывоз со склада
не задан,Моторчик печки для Daewoo Matiz 2008г,1000.00₽,Matiz M200 2005-2010гг,Хэтчбек,2008,B10S1,передний,-,-,-,Daewoo,Самовывоз со склада
